### ISSUE TITLE
Add Roku Soundbridges to list of speakers.

### ISSUE THREAD

**Issue by frankusb** [owntone/owntone-server#1389]
This seems to fit well into the current paradigm. Roku Control Protocol (RCP) allows Get/SetPowerState, Get/SetVolume. Owntone provides an mp3 stream that could be used as the source for SetWorkingSongInfo (other commands/responses needed before and after).

**Comment by whatdoineed2do** [comment]
This would be interesting.

I have a M1000 and a M500 - they are both set to play from owntone's mp3 stream when they boot up (so kids can switch on this and then select stuff from the web interface on their tablet).

Would this mean that no matter what the roku is doing, the speaker selection command would communicate with the roku and force it to play from the mp3 stream?

I remember a few yrs ago looking through the roku docs adn the RSP commands but it seems to have been purged from roku's website.  @frankusb - do you have a copy or a link of this?

**Comment by frankusb** [comment]
> This would be interesting.

I have other ideas. This is the first basic step.

> I have a M1000 and a M500 - they are both set to play from owntone's mp3 stream when they boot up (so kids can switch on this and then select stuff from the web interface on their tablet).

Oh, I suppose if you power it off with a stream playing, it will resume on power up.

> Would this mean that no matter what the roku is doing, the speaker selection command would communicate with the roku and force it to play from the mp3 stream?

Yes, RCP allows complete control. So the speaker selection command could do whatever it needs to do.

> I remember a few yrs ago looking through the roku docs and the RSP commands but it seems to have been purged from roku's website. @frankusb - do you have a copy or a link of this?

[SoundBridgeRCPSpecification2-4.pdf](https://github.com/owntone/owntone-server/files/7872630/SoundBridgeRCPSpecification2-4.pdf)

**Comment by whatdoineed2do** [comment]
@frankusb - I've some work in progress that implements this functionality in this branch and appreciate some help with testing:
https://github.com/whatdoineed2do/forked-daapd/tree/outputs-soundbridge

It works with my M1000 and you need to add to your config file these lines (server ip or hostname to be changed of course):
```
rcp "Soundbridge M1000" {
   server = "192.168.0.3"
}
```
You can also have multiple SoundBridges just create another entry with different name.

There's a bug in it right now that to enable the output, you have to bring up the speaker list, and toggle off/on the soundbridge - that will force OwnTone to connect to the stream.mp3.  Will open a draft PR for feedback but need to fix this bug.

**Comment by frankusb** [comment]
Hmm, I had to ln -s owntone-sqlext.la forked-daapd-sqlext.la and ln -s owntone-sqlext.so forked-daapd-sqlext.so in /usr/lib/owntone. I added and rcp entry in the config file. It shows up but toggling it gives "[2022-01-20 13:18:47] [  LOG]      rcp: Ignoring send request on 192.168.1.40, state = 15"

**Comment by frankusb** [comment]
More detail.

[2022-01-20 13:28:34] [DEBUG]      rcp: 3044 state 3 recv'd 1 bytes 'S'
[2022-01-20 13:28:34] [DEBUG]      rcp: 3044 state 3 recv'd 5 bytes 'etWor'
[2022-01-20 13:28:34] [DEBUG]      rcp: 3044 state 3 recv'd 5 bytes 'kingS'
[2022-01-20 13:28:34] [DEBUG]      rcp: 3044 state 3 recv'd 5 bytes 'ongIn'
[2022-01-20 13:28:34] [DEBUG]      rcp: 3044 state 3 recv'd 5 bytes 'fo: O'
[2022-01-20 13:28:34] [DEBUG]      rcp: 3044 state 3 recv'd 3 bytes 'K
'
[2022-01-20 13:28:34] [DEBUG]      rcp: 3044 state 3   send 'SetWorkingSongInfo playlistURL http://127.0.1.1:3689/stream.mp3'
[2022-01-20 13:28:34] [DEBUG]      rcp: 3044 state 4 recv'd 1 bytes 'S'
[2022-01-20 13:28:34] [DEBUG]      rcp: 3044 state 4 recv'd 23 bytes 'etWorkingSongInfo: OK
'
[2022-01-20 13:28:34] [DEBUG]      rcp: 3044 state 4   send 'SetWorkingSongInfo remoteStream 1'
[2022-01-20 13:28:34] [DEBUG]      rcp: 3044 state 5 recv'd 1 bytes 'S'
[2022-01-20 13:28:34] [DEBUG]      rcp: 3044 state 5 recv'd 13 bytes 'etWorkingSong'
[2022-01-20 13:28:34] [DEBUG]      rcp: 3044 state 5 recv'd 10 bytes 'Info: OK
'
[2022-01-20 13:28:34] [DEBUG]      rcp: 3044 state 5   send 'QueueAndPlayOne working'
[2022-01-20 13:28:34] [DEBUG]      rcp: 3044 state 8 recv'd 1 bytes 'Q'
[2022-01-20 13:28:34] [DEBUG]      rcp: 3044 state 8 recv'd 23 bytes 'ueueAndPlayOne: Paramet'
[2022-01-20 13:28:34] [DEBUG]      rcp: 3044 state 8 recv'd 9 bytes 'erError
'
[2022-01-20 13:28:34] [ WARN]      rcp: Unexpected response (QueueAndPlayOne: ParameterError
) in state 8 'M2000 Office' at 192.168.1.40
[2022-01-20 13:28:34] [DEBUG]      rcp: session shutdown 3044 M2000 Office at 192.168.1.40
[2022-01-20 13:28:34] [DEBUG]      rcp: 3044 state 15   send 'Stop'

**Comment by whatdoineed2do** [comment]
urgh. Somehow the node name (equiv to `uname -n`) to ip resolution i'm doing that gets it wrong to think the owntone server is on 127.0.1.1 loopback address (thats why when the roku is told to play, it gets it wrong).  Can you also do `ifconfig -a | grep inet`?

Can you verify that this works on your side by issuing the same commands the `rcp` module is doing:
```
$ telnet 192.168.1.40 5555
ClearWorkingSong
SetWorkingSongInfo title Testing Testing
SetWorkingSongInfo playlistURL **your_owntone_address_running_rcp_code**:3689/stream.mp3
SetWorkingSongInfo remoteStream 1
QueueAndPlayOne working
```
After each command you isuse on telnet, you'll get a response of "xxxx: OK".

At this point on start play on the owntone server and it should start streaming to the roku.

If this works can you also try **your_owntone_address_running_rcp_code** wtih `owntone.local` and see if that works?

**Comment by frankusb** [comment]
> $ uname -n
> oberon

> $ ifconfig -a | grep inet
> -bash: ifconfig: command not found

This is not what I expected.

> $ telnet 192.168.1.40 5555
> Trying 192.168.1.40...
> Connected to 192.168.1.40.
> Escape character is '^]'.
> roku: ready
> ClearWorkingSong
> ClearWorkingSong: OK
> SetWorkingSongInfo title Testing Testing
> SetWorkingSongInfo: OK
> SetWorkingSongInfo playlistURL http://192.168.1.88:3689/stream.mp3
> SetWorkingSongInfo: OK
> SetWorkingSongInfo remoteStream 1
> SetWorkingSongInfo: OK
> QueueAndPlayOne working
> QueueAndPlayOne: ParameterError

I have a Soundbridge preset of "http://oberon.attlocal.net:3689/stream.mp3" that does work. Using oberon.local does not.

I found this works.

> ClearWorkingSong               
> ClearWorkingSong: OK
> SetWorkingSongInfo title Testing Testing
> SetWorkingSongInfo: OK
> SetWorkingSongInfo playlistURL http://oberon.attlocal.net:3689/stream.mp3
> SetWorkingSongInfo: OK
> SetWorkingSongInfo remoteStream 1
> SetWorkingSongInfo: OK
> QueueAndPlayOne working
> QueueAndPlayOne: OK

**Comment by frankusb** [comment]
OK, I think I see what's going on.

> $ ip addr
> 1: lo: <LOOPBACK,UP,LOWER_UP> mtu 65536 qdisc noqueue state UNKNOWN group default qlen 1000
>     link/loopback 00:00:00:00:00:00 brd 00:00:00:00:00:00
>     inet 127.0.0.1/8 scope host lo
>        valid_lft forever preferred_lft forever
>     inet6 ::1/128 scope host 
>        valid_lft forever preferred_lft forever
> 2: enp1s0: <BROADCAST,MULTICAST,UP,LOWER_UP> mtu 1500 qdisc pfifo_fast state UP group default qlen 1000
>     link/ether 4c:cc:6a:d9:94:3b brd ff:ff:ff:ff:ff:ff
>     inet 192.168.1.88/24 brd 192.168.1.255 scope global enp1s0
>        valid_lft forever preferred_lft forever
>     inet 192.168.1.119/24 brd 192.168.1.255 scope global secondary dynamic enp1s0
>        valid_lft 65767sec preferred_lft 65767sec

> ClearWorkingSong
> ClearWorkingSong: OK
> SetWorkingSongInfo title Testing Testing
> SetWorkingSongInfo: OK
> SetWorkingSongInfo playlistURL http://192.168.1.119:3689/stream.mp3
> SetWorkingSongInfo: OK
> SetWorkingSongInfo remoteStream 1
> SetWorkingSongInfo: OK
> QueueAndPlayOne working
> QueueAndPlayOne: OK

**Comment by frankusb** [comment]
I hardcoded the IP address and that's more or less working. You are not changing the power state so if the device is powered off, it won't power on and play (at least in my trials).

**Comment by whatdoineed2do** [comment]
Good point on the teardown to put it into standby.. Will look at that over weekend 

Still interested at how it resolved to 127.0.1.1 which wasn't even an address shown by ip. I'll knock up some  ode for you to run to dump the ips 

I added one more commit to the branch to fix handling errors d we vices so if you can try to paly with it to see if anything odd.  Also instead of hard coding an ip at line 604 rcp.c see if using a host name will work ie oberan.

Regarding metadata.. using the playkixt method means the soundbite asks for icy metadata which shows title and artist on the display. This metadata is spliced into the mp3 stream periodically so roku should display it

**Comment by frankusb** [comment]
I think you will also want to stop playback on teardown otherwise, the next time the user powers on it will try to connect.

`[2022-01-20 17:41:44] [DEBUG]      rcp: 3044 state 3   send 'SetWorkingSongInfo playlistURL http://oberon.attlocal.net:3689/stream.mp3'`

Is the above what you are asking me to try? My thinking is anything you can put in to a preset on the Soundbridge web page will work with the SetWorkingSongInfo command. My AT&T router resolves DNS on my network. I'm hopelessly confused though.

```
PING oberon.attlocal.net (192.168.1.88): 56 data bytes
64 bytes from 192.168.1.88: icmp_seq=0 ttl=64 time=0.615 ms
```
Now I can issue commands using either IP.

```
ClearWorkingSong
ClearWorkingSong: OK
SetWorkingSongInfo title Testing Testing
SetWorkingSongInfo: OK
SetWorkingSongInfo playlistURL http://192.168.1.88:3689/stream.mp3
SetWorkingSongInfo: OK
SetWorkingSongInfo remoteStream 1
SetWorkingSongInfo: OK
QueueAndPlayOne working
QueueAndPlayOne: OK
ClearWorkingSong
ClearWorkingSong: OK
SetWorkingSongInfo title Testing Testing
SetWorkingSongInfo: OK
SetWorkingSongInfo playlistURL http://192.168.1.119:3689/stream.mp3
SetWorkingSongInfo: OK
SetWorkingSongInfo remoteStream 1
SetWorkingSongInfo: OK
QueueAndPlayOne working
QueueAndPlayOne: OK
```

Metadata is displaying fine. I must not have given it enough time.

I updated to the latest code.

I can see where you are grabbing the IP. I may experiment as well.

**Comment by frankusb** [comment]
My root problem is [here](https://www.debian.org/doc/manuals/debian-reference/ch05.en.html#_the_hostname_resolution). I recently did a fresh install of a Debian 11 system without a permanent IP address and /etc/hosts does not contain the hostname at all.

**Comment by frankusb** [comment]
I think I understand the issue. My multiple IP addresses do not appear to be a problem. I think the command stream is incomplete.

Page 177 of the RCP specification states "Note that the RCP host must be connected to a music server before the
QueueAndPlayOne command is issued. (The Internet Radio server is a good candidate for this purpose.). I think the commands at the top of page 176 need to be issued before the existing commands are sent.

**Comment by frankusb** [comment]
When I deselect my Soundbridge I get (filtered by grep rcp):
```
[2022-01-20 19:22:52] [DEBUG]      rcp: device flush 3044 'M2000 Office'
[2022-01-20 19:22:52] [DEBUG]      rcp: device cb 3044 'M2000 Office'  callback 0
[2022-01-20 19:22:53] [DEBUG]      rcp: device stop 3044 'M2000 Office'
[2022-01-20 19:22:53] [DEBUG]      rcp: session shutdown 3044 M2000 Office at 192.168.1.40
[2022-01-20 19:22:53] [DEBUG]      rcp: 3044 state 0   send 'Stop'
[2022-01-20 19:22:53] [DEBUG]      rcp: session cleanup 3044 M2000 Office at 192.168.1.40
[2022-01-20 19:22:53] [DEBUG]      rcp: session free 3044 M2000 Office at 192.168.1.40
[2022-01-20 19:22:53] [ WARN]      rcp: WARNING: struct rcp_session not found in list; BUG!
[2022-01-20 19:23:00] [DEBUG]      rcp: init
[2022-01-20 19:23:00] [ INFO]      rcp: Adding RCP output device 'M2000 Office' at '192.168.1.40'
```

**Comment by frankusb** [comment]
With the changes c046745 and 2f80b1c, no more WARNINGs.

**Comment by whatdoineed2do** [comment]
I've fixed that crash on speaker deselect in a couple of commtits you noted above (it was a bug in an attempt to deselect the speaker when an error occured)

Re: hostname resolution - you are relying on your AT&T router to do DNS (as configured at the roku).  my router doesn't do this as i think will a large number of normal users (i'm also running all of my raspberry pis and rokus with static ips).

I also tried using owntone's published mdns name as the source of the stream.mp3 - i modified it so it announces `<server>.local` rather than `owntone.local` since i have 3x RPI on the same network.

Attempting playback after `SetWorkingSongInfo playlistURL http://rpi4.local:3689/stream.mp3` fails.. however if i switch out `rpi4.local` to the ip works as per local testing so i'm concluding that the roku will do name to host resolution if there is a suitable DNS but thats not always the case so safest is to use IP (of the machine running `owntone`) to start playback.


What i do see is that the roku does announce itself to the netwrk so theres an opportunity (later) to auto discover soundbridges
```
$ avahi-browse -r -k _roku-rcp._tcp
+  bond0 IPv4 SoundBridge                                   _roku-rcp._tcp       local
=  bond0 IPv4 SoundBridge                                   _roku-rcp._tcp       local
   hostname = [SoundBridge.local]
   address = [192.168.0.3]
   port = [5555]
   txt = []
```
Give the current set some testing and let me know if anything odd pops up - will also give a go at trying to figure out whats going on with ip resolution

**Comment by frankusb** [comment]
> Re: hostname resolution - you are relying on your AT&T router to do DNS (as configured at the roku). my router doesn't do this as i think will a large number of normal users (i'm also running all of my raspberry pis and rokus with static ips).

That is correct. I would not count on this being available in most cases.

> Give the current set some testing and let me know if anything odd pops up - will also give a go at trying to figure out whats going on with ip resolution

Are you referring to the 127.0.1.1 I initially reported? That was caused by Debian putting <hostname> 127.0.1.1 in /etc/hosts.

All in all, this addition is pretty awesome. It seems feasible and allows web control of the Soundbridge.

The current restrictions are that you have to power on the Soundbridge and switch the music library to Internet Radio. From there, it's hands off and in control of Owntone. Very nice.

**Comment by whatdoineed2do** [comment]
A few more fixes that'd be great if you can help test - i will do so likewise over the few days; the code will now take the roku out of and back into standby.

I'm interested in knowing how it works when you startup.. on the speaker selection they should be greyed out and only come alive after you click (and initiate the setup sequence to queue the stream.mp3 playlist) and also if you kill the rok udoes the speaker selection reflect that (ie handle the roku disappearing etc)

If you removed the 127.0.1.1 for /etc/hosts i'm hoping you can let the code figure out what hte stream the roku should use (its printed in hte logs for ref)

**Comment by frankusb** [comment]
> If you removed the 127.0.1.1 for /etc/hosts i'm hoping you can let the code figure out what hte stream the roku should use (its printed in hte logs for ref)

I removed 127.0.1.1 last night. I'm clean on the checkout.

**Comment by frankusb** [comment]
I built and installed. It's not working very well. It seems to power on and off fine. But when it's powered on, it's not choosing the Internet Radio music library so it fails to play. That's what I was referring to in a previous comment. If I manually select the Internet Radio music library then it plays. But if Owntone turns if off it won't come back on and play again. Log attached
[rcplog.txt](https://github.com/owntone/owntone-server/files/7916078/rcplog.txt)
.

**Comment by whatdoineed2do** [comment]
Thanks for quick test .. This line advises the problem (`QueueAndPlayOne working` returns `ParameterError` which, in this configuration means it can't get to the configured playlist - its what happens when you test and `SetWorkingSongInfo playlistURL ...` to a location unreachable by the roku)
```
rcp: Failed to start stream, remote unable to reach 'http://192.168.1.88:3689/stream.mp3'
```
Previously you had mentioned that you didnt know why your machine had 2 address.  We can see in this line above that we picked up the first ip for your node (being `...1.88` rather than the `...1.119` address that comes from dhcp that you mentioend was working
```
2: enp1s0: <BROADCAST,MULTICAST,UP,LOWER_UP> mtu 1500 qdisc pfifo_fast state UP group default qlen 1000
    link/ether 4c:cc:6a:d9:94:3b brd ff:ff:ff:ff:ff:ff
    inet 192.168.1.88/24 brd 192.168.1.255 scope global enp1s0
       valid_lft forever preferred_lft forever
    inet 192.168.1.119/24 brd 192.168.1.255 scope global secondary dynamic enp1s0
       valid_lft 65767sec preferred_lft 65767sec
```
This could be bug / misconfig'd system -  I need to figure out ...   in the meantime, with the latest commits, `misc.c:512`, replace `host_addr` with`192.168.1.119` and that'll get you through this for now.

On a machine that is on the same network that  is NOT oberan/192.168.1.119, are you able to reach `http://192.168.1.88:3689/stream.mp3` when owntone is running? (ie from a browser on your phone will do)

**Comment by frankusb** [comment]
I don't think the IP address is the issue. When I power own my Soundbridge, it gives me a list of music libraries to connect to. One of those is the built in Internet Radio. This library has to be selected before either ip address stream will work over RCP.

I can put either IP address in a Soundbridge preset and it plays just fine. And the Soundbridge distinguishes between URLs and Playlists. If you use the Play button on a preset, it selects the Internet Radio library and then loads the URL.

<img width="650" alt="Screen Shot 2022-01-21 at 3 16 53 PM" src="https://user-images.githubusercontent.com/63519142/150601257-3a5fda34-1419-4644-bfe0-2a2029a3a76a.png">

Are you suggesting that if you select your Owntone RSP music library, the Owntone speaker button is able to play a stream for you?

I had the same issue yesterday when I hard coded the ip address in the code. It would only play the stream if it was currently in the Internet Radio library. This is documented in the RCP.

Page 177 of the RCP specification states "Note that the RCP host must be connected to a music server before the
QueueAndPlayOne command is issued. (The Internet Radio server is a good candidate for this purpose.)".

**Comment by frankusb** [comment]
I'm guessing you probably only use your Soundbridge to play streaming URLs so it stays in the Internet Radio music library. I use my Soundbridges mainly RSP so it usually starts from there.

**Comment by frankusb** [comment]
I am full of bad news today. First, the entry in /etc/hosts appears to conflict with .local resolution. My Debian system is not able to ping .local devices without the entry.

I also see:

> [2022-01-22 09:05:11] [  LOG]     mdns: Avahi state change: Client connecting
> [2022-01-22 09:26:27] [  LOG]     mdns: Avahi state change: Client registering
> [2022-01-22 09:26:27] [  LOG]     mdns: Avahi state change: Client running
> [2022-01-22 09:26:34] [  LOG]     mdns: Avahi state change: Client failure
> [2022-01-22 09:26:34] [  LOG]     mdns: Avahi Server disconnected, reconnecting
> [2022-01-22 09:26:34] [  LOG]     mdns: Avahi state change: Client registering
> [2022-01-22 09:26:35] [  LOG]     mdns: Avahi state change: Client running
> [2022-01-22 09:26:57] [  LOG]     mdns: Avahi state change: Client failure

Second, when I power up my Soundbridge, it's sitting at the main screen to select a library. This happens when it was previously connected to Owntone RSP and I restart Owntone. In this case it's not connected to any server.

> [2022-01-22 09:33:36] [DEBUG]      rcp: device start 3044 'M2000 Office'
> [2022-01-22 09:33:36] [DEBUG]      rcp: make session 3044 M2000 Office at 192.168.1.40 initial vol=0
> [2022-01-22 09:33:36] [ INFO]      rcp: Connection to 'M2000 Office' established
> [2022-01-22 09:33:36] [DEBUG]      rcp: device cb 3044 'M2000 Office'  callback 1
> [2022-01-22 09:33:36] [DEBUG]      rcp: 3044 state 0 recv'd 13 bytes 'roku: ready
> [2022-01-22 09:33:36] [DEBUG]      rcp: 3044 state 0   send 'SetPowerState on no'
> [2022-01-22 09:33:36] [DEBUG]      rcp: 3044 state 1 recv'd 1 bytes 'S'
> [2022-01-22 09:33:36] [DEBUG]      rcp: 3044 state 1 recv'd 6 bytes 'etPowe'
> [2022-01-22 09:33:36] [DEBUG]      rcp: 3044 state 1 recv'd 6 bytes 'rState'
> [2022-01-22 09:33:36] [DEBUG]      rcp: 3044 state 1 recv'd 6 bytes ': OK
> [2022-01-22 09:33:36] [DEBUG]      rcp: 3044 state 1   send 'GetConnectedServer'
> [2022-01-22 09:33:36] [DEBUG]      rcp: 3044 state 2 recv'd 1 bytes 'G'
> [2022-01-22 09:33:36] [DEBUG]      rcp: 3044 state 2 recv'd 12 bytes 'etConnectedS'
> [2022-01-22 09:33:36] [DEBUG]      rcp: 3044 state 2 recv'd 6 bytes 'erver:'
> [2022-01-22 09:33:36] [DEBUG]      rcp: 3044 state 2 recv'd 6 bytes ' Gener'
> [2022-01-22 09:33:36] [DEBUG]      rcp: 3044 state 2 recv'd 9 bytes 'icError
> [2022-01-22 09:33:36] [ WARN]      rcp: Unexpected response (GetConnectedServer: GenericError
> [2022-01-22 09:33:36] [DEBUG]      rcp: session shutdown 3044 M2000 Office at 192.168.1.40
> [2022-01-22 09:33:36] [DEBUG]      rcp: 3044 state 31   send 'SetPowerState standby'
> [2022-01-22 09:33:36] [DEBUG]      rcp: session cleanup 3044 M2000 Office at 192.168.1.40
> [2022-01-22 09:33:36] [DEBUG]      rcp: session free 3044 M2000 Office at 192.168.1.40
> [2022-01-22 09:33:38] [DEBUG]      rcp: device start 3044 'M2000 Office'
> [2022-01-22 09:33:38] [DEBUG]      rcp: make session 3044 M2000 Office at 192.168.1.40 initial vol=0
> [2022-01-22 09:33:38] [ INFO]      rcp: Connection to 'M2000 Office' established
> [2022-01-22 09:33:38] [DEBUG]      rcp: device cb 3044 'M2000 Office'  callback 1
> [2022-01-22 09:33:38] [DEBUG]      rcp: 3044 state 0 recv'd 1 bytes 'r'
> [2022-01-22 09:33:38] [DEBUG]      rcp: 3044 state 0 recv'd 7 bytes 'oku: re'
> [2022-01-22 09:33:38] [DEBUG]      rcp: 3044 state 0 recv'd 5 bytes 'ady
> [2022-01-22 09:33:38] [DEBUG]      rcp: 3044 state 0   send 'SetPowerState on no'
> [2022-01-22 09:33:38] [DEBUG]      rcp: 3044 state 1 recv'd 19 bytes 'SetPowerState: OK
> [2022-01-22 09:33:38] [DEBUG]      rcp: 3044 state 1   send 'GetConnectedServer'
> [2022-01-22 09:33:38] [DEBUG]      rcp: 3044 state 2 recv'd 34 bytes 'GetConnectedServer: GenericError
> [2022-01-22 09:33:38] [ WARN]      rcp: Unexpected response (GetConnectedServer: GenericError
> [2022-01-22 09:33:38] [DEBUG]      rcp: session shutdown 3044 M2000 Office at 192.168.1.40
> [2022-01-22 09:33:38] [DEBUG]      rcp: 3044 state 31   send 'SetPowerState standby'
> [2022-01-22 09:33:38] [DEBUG]      rcp: session cleanup 3044 M2000 Office at 192.168.1.40
> [2022-01-22 09:33:38] [DEBUG]      rcp: session free 3044 M2000 Office at 192.168.1.40

**Comment by frankusb** [comment]
If I connect it to a server and try, it does not work.

> [2022-01-22 09:41:29] [DEBUG]      rcp: device start 3044 'M2000 Office'
> [2022-01-22 09:41:29] [DEBUG]      rcp: make session 3044 M2000 Office at 192.168.1.40 initial vol=0
> [2022-01-22 09:41:29] [ INFO]      rcp: Connection to 'M2000 Office' established
> [2022-01-22 09:41:29] [DEBUG]      rcp: device cb 3044 'M2000 Office'  callback 1
> [2022-01-22 09:41:29] [DEBUG]      rcp: 3044 state 0 recv'd 13 bytes 'roku: ready
> [2022-01-22 09:41:29] [DEBUG]      rcp: 3044 state 0   send 'SetPowerState on no'
> [2022-01-22 09:41:29] [DEBUG]      rcp: 3044 state 1 recv'd 1 bytes 'S'
> [2022-01-22 09:41:29] [DEBUG]      rcp: 3044 state 1 recv'd 10 bytes 'etPowerSta'
> [2022-01-22 09:41:29] [DEBUG]      rcp: 3044 state 1 recv'd 8 bytes 'te: OK
> [2022-01-22 09:41:29] [DEBUG]      rcp: 3044 state 1   send 'GetConnectedServer'
> [2022-01-22 09:41:29] [DEBUG]      rcp: 3044 state 2 recv'd 24 bytes 'GetConnectedServer: OK
> [2022-01-22 09:41:29] [DEBUG]      rcp: 3044 state 2   send 'ServerDisconnect'
> [2022-01-22 09:41:29] [DEBUG]      rcp: 3044 state 3 recv'd 9 bytes 'ServerDis'
> [2022-01-22 09:41:29] [DEBUG]      rcp: 3044 state 3 recv'd 8 bytes 'connect:'
> [2022-01-22 09:41:29] [DEBUG]      rcp: 3044 state 3 recv'd 8 bytes ' Transac'
> [2022-01-22 09:41:29] [DEBUG]      rcp: 3044 state 3 recv'd 15 bytes 'tionInitiated
> [2022-01-22 09:41:34] [DEBUG]      rcp: 3044 state 4 recv'd 1 bytes 'S'
> [2022-01-22 09:41:34] [DEBUG]      rcp: 3044 state 4 recv'd 20 bytes 'erverDisconnect: Dis'
> [2022-01-22 09:41:34] [DEBUG]      rcp: 3044 state 4 recv'd 11 bytes 'connected
> [2022-01-22 09:41:34] [DEBUG]      rcp: 3044 state 5 recv'd 6 bytes 'Server'
> [2022-01-22 09:41:34] [DEBUG]      rcp: 3044 state 5 recv'd 6 bytes 'Discon'
> [2022-01-22 09:41:34] [DEBUG]      rcp: 3044 state 5 recv'd 6 bytes 'nect: '
> [2022-01-22 09:41:34] [DEBUG]      rcp: 3044 state 5 recv'd 7 bytes 'Transac'
> [2022-01-22 09:41:34] [DEBUG]      rcp: 3044 state 5 recv'd 8 bytes 'tionComp'
> [2022-01-22 09:41:34] [DEBUG]      rcp: 3044 state 5 recv'd 6 bytes 'lete
> [2022-01-22 09:41:34] [DEBUG]      rcp: 3044 state 6   send 'SetServerFilter radio'
> [2022-01-22 09:41:34] [DEBUG]      rcp: 3044 state 7 recv'd 1 bytes 'S'
> [2022-01-22 09:41:34] [DEBUG]      rcp: 3044 state 7 recv'd 20 bytes 'etServerFilter: OK
> [2022-01-22 09:41:34] [DEBUG]      rcp: 3044 state 7   send 'ListServers'
> [2022-01-22 09:41:34] [DEBUG]      rcp: 3044 state 8 recv'd 1 bytes 'L'
> [2022-01-22 09:41:34] [DEBUG]      rcp: 3044 state 8 recv'd 8 bytes 'istServe'
> [2022-01-22 09:41:34] [DEBUG]      rcp: 3044 state 8 recv'd 4 bytes 'rs: '
> [2022-01-22 09:41:34] [DEBUG]      rcp: 3044 state 8 recv'd 6 bytes 'ListRe'
> [2022-01-22 09:41:34] [DEBUG]      rcp: 3044 state 8 recv'd 9 bytes 'sultSize '
> [2022-01-22 09:41:34] [DEBUG]      rcp: 3044 state 8 recv'd 8 bytes '1
> [2022-01-22 09:41:34] [DEBUG]      rcp: 3044 state 8 recv'd 8 bytes 'ervers: '
> [2022-01-22 09:41:34] [DEBUG]      rcp: 3044 state 8 recv'd 8 bytes 'Internet'
> [2022-01-22 09:41:34] [DEBUG]      rcp: 3044 state 8 recv'd 8 bytes ' Radio
> [2022-01-22 09:41:34] [ WARN]      rcp: Unexpected response (ListServers: ListResultSize 1
> [2022-01-22 09:41:34] [DEBUG]      rcp: session shutdown 3044 M2000 Office at 192.168.1.40
> [2022-01-22 09:41:34] [DEBUG]      rcp: 3044 state 31   send 'SetPowerState standby'
> [2022-01-22 09:41:34] [DEBUG]      rcp: session cleanup 3044 M2000 Office at 192.168.1.40
> [2022-01-22 09:41:34] [DEBUG]      rcp: session free 3044 M2000 Office at 192.168.1.40

**Comment by whatdoineed2do** [comment]
The bug you mention above is the response continaing multiple responses which was not handled well.  I also had some issue with my M1000 that the discconnect as the spec gave me some odd errors (assume its because its already in _Internet Radio_ state) but the code should handle both the defined behaviour.

This is the seqence of my calls to the M1000 which allows it to stream - theres some handling of disabling stream on errors and wil try to work on that, if can take a look and let me know if your M2000 in its _daap_ or _RSP_ mode works now:
```
[2022-01-22 22:48:38] [DEBUG]      rcp: device probe 3045 'Soundbridge M1000'
[2022-01-22 22:48:39] [DEBUG]      rcp: make session 3045 Soundbridge M1000 at 192.168.0.3 initial vol=0
[2022-01-22 22:48:39] [ INFO]      rcp: Connection to 'Soundbridge M1000' established
[2022-01-22 22:48:39] [DEBUG]      rcp: device cb 3045 'Soundbridge M1000'  callback 1
[2022-01-22 22:48:39] [DEBUG]      rcp: 3045 state 0 recv'd 1 bytes 'r'
[2022-01-22 22:48:39] [DEBUG]      rcp: 3045 state 0 recv'd 12 bytes 'oku: ready
'
[2022-01-22 22:48:39] [DEBUG]      rcp: 3045 state 0   send 'SetPowerState on no'
[2022-01-22 22:48:39] [DEBUG]      rcp: 3045 state 1 recv'd 1 bytes 'S'
[2022-01-22 22:48:39] [DEBUG]      rcp: 3045 state 1 recv'd 18 bytes 'etPowerState: OK
'
[2022-01-22 22:48:39] [DEBUG]      rcp: 3045 state 1   send 'GetConnectedServer'
[2022-01-22 22:48:39] [DEBUG]      rcp: 3045 state 2 recv'd 1 bytes 'G'
[2022-01-22 22:48:39] [DEBUG]      rcp: 3045 state 2 recv'd 31 bytes 'etConnectedServer: GenericError'
[2022-01-22 22:48:39] [DEBUG]      rcp: 3045 state 2 recv'd 2 bytes '
'
[2022-01-22 22:48:39] [DEBUG]      rcp: 3045 state 2   send 'ServerDisconnect'
[2022-01-22 22:48:39] [DEBUG]      rcp: 3045 state 3 recv'd 1 bytes 'S'
[2022-01-22 22:48:39] [DEBUG]      rcp: 3045 state 3 recv'd 36 bytes 'erverDisconnect: ErrorDisconnected
'
[2022-01-22 22:48:39] [DEBUG]      rcp: 3045 state 6   send 'SetServerFilter radio'
[2022-01-22 22:48:39] [DEBUG]      rcp: 3045 state 7 recv'd 1 bytes 'S'
[2022-01-22 22:48:39] [DEBUG]      rcp: 3045 state 7 recv'd 20 bytes 'etServerFilter: OK
'
[2022-01-22 22:48:39] [DEBUG]      rcp: 3045 state 7   send 'ListServers'
[2022-01-22 22:48:39] [DEBUG]      rcp: 3045 state 8 recv'd 1 bytes 'L'
[2022-01-22 22:48:39] [DEBUG]      rcp: 3045 state 8 recv'd 30 bytes 'istServers: ListResultSize 1
'
[2022-01-22 22:48:39] [DEBUG]      rcp: 3045 state 9 recv'd 32 bytes 'ListServers: Internet Radio
Lis'
[2022-01-22 22:48:39] [DEBUG]      rcp: 3045 state 10 recv'd 25 bytes 'tServers: ListResultEnd
'
[2022-01-22 22:48:39] [DEBUG]      rcp: 3045 state 11   send 'ServerConnect 0'
[2022-01-22 22:48:39] [DEBUG]      rcp: 3045 state 12 recv'd 1 bytes 'S'
[2022-01-22 22:48:39] [DEBUG]      rcp: 3045 state 12 recv'd 36 bytes 'erverConnect: TransactionInitiated
'
[2022-01-22 22:48:39] [DEBUG]      rcp: 3045 state 13 recv'd 1 bytes 'S'
[2022-01-22 22:48:39] [DEBUG]      rcp: 3045 state 13 recv'd 61 bytes 'erverConnect: Connected
ServerConnect: TransactionComplete
'
[2022-01-22 22:48:39] [DEBUG]      rcp: 3045 state 15   send 'GetVolume'
[2022-01-22 22:48:39] [DEBUG]      rcp: 3045 state 16 recv'd 1 bytes 'G'
[2022-01-22 22:48:39] [DEBUG]      rcp: 3045 state 16 recv'd 14 bytes 'etVolume: 96
'
[2022-01-22 22:48:39] [DEBUG]      rcp: 3045 state 16   send 'ClearWorkingSong'
[2022-01-22 22:48:39] [DEBUG]      rcp: 3045 state 17 recv'd 1 bytes 'C'
[2022-01-22 22:48:39] [DEBUG]      rcp: 3045 state 17 recv'd 21 bytes 'learWorkingSong: OK
'
[2022-01-22 22:48:39] [DEBUG]      rcp: 3045 state 17   send 'SetWorkingSongInfo title OwnTone sonic stream'
[2022-01-22 22:48:39] [DEBUG]      rcp: 3045 state 18 recv'd 1 bytes 'S'
[2022-01-22 22:48:39] [DEBUG]      rcp: 3045 state 18 recv'd 23 bytes 'etWorkingSongInfo: OK
'
[2022-01-22 22:48:39] [DEBUG]      rcp: 3045 state 18   send 'SetWorkingSongInfo playlistURL http://192.168.0.104:3680/stream.mp3'
[2022-01-22 22:48:39] [DEBUG]      rcp: 3045 state 19 recv'd 1 bytes 'S'
[2022-01-22 22:48:39] [DEBUG]      rcp: 3045 state 19 recv'd 23 bytes 'etWorkingSongInfo: OK
'
[2022-01-22 22:48:39] [DEBUG]      rcp: 3045 state 19   send 'SetWorkingSongInfo remoteStream 1'
[2022-01-22 22:48:39] [DEBUG]      rcp: 3045 state 20 recv'd 1 bytes 'S'
[2022-01-22 22:48:39] [DEBUG]      rcp: 3045 state 20 recv'd 23 bytes 'etWorkingSongInfo: OK
'
[2022-01-22 22:48:39] [DEBUG]      rcp: 3045 state 20   send 'QueueAndPlayOne working'
[2022-01-22 22:48:39] [DEBUG]      rcp: 3045 state 23 recv'd 1 bytes 'Q'
[2022-01-22 22:48:39] [DEBUG]      rcp: 3045 state 23 recv'd 20 bytes 'ueueAndPlayOne: OK
```
This plays as it did before for me.

**Comment by frankusb** [comment]
I've updated and still see the below failure.

```
[2022-01-23 07:28:09] [ INFO]      rcp: Connection to 'M2000 Office' established
[2022-01-23 07:28:09] [DEBUG]      rcp: device cb 480785763 'M2000 Office'  callback 1
[2022-01-23 07:28:09] [DEBUG]      rcp: 480785763 state 0 recv'd 8 bytes 'roku: re'
[2022-01-23 07:28:09] [DEBUG]      rcp: 480785763 state 0 recv'd 5 bytes 'ady
[2022-01-23 07:28:09] [DEBUG]      rcp: 480785763 state 0   send 'SetPowerState on no'
[2022-01-23 07:28:09] [DEBUG]      rcp: 480785763 state 1 recv'd 19 bytes 'SetPowerState: OK
[2022-01-23 07:28:09] [DEBUG]      rcp: 480785763 state 1   send 'GetConnectedServer'
[2022-01-23 07:28:09] [DEBUG]      rcp: 480785763 state 2 recv'd 34 bytes 'GetConnectedServer: GenericError
[2022-01-23 07:28:09] [DEBUG]      rcp: 480785763 state 2   send 'ServerDisconnect'
[2022-01-23 07:28:09] [DEBUG]      rcp: 480785763 state 3 recv'd 1 bytes 'S'
[2022-01-23 07:28:09] [DEBUG]      rcp: 480785763 state 3 recv'd 115 bytes 'erverDisconnect: TransactionInitiated
[2022-01-23 07:28:09] [ WARN]      rcp: Unexpected response (ServerDisconnect: TransactionComplete
[2022-01-23 07:28:09] [DEBUG]      rcp: session shutdown 480785763 M2000 Office at 192.168.1.40
[2022-01-23 07:28:09] [DEBUG]      rcp: 480785763 state 31   send 'SetPowerState standby'
[2022-01-23 07:28:09] [DEBUG]      rcp: session cleanup 480785763 M2000 Office at 192.168.1.40
[2022-01-23 07:28:09] [DEBUG]      rcp: session free 480785763 M2000 Office at 192.168.1.40
```

**Comment by whatdoineed2do** [comment]
This is odd.  The spec. p106, says it should be

send `ServerDiscconnect`
resp#1 `ServerDisconnect: TransactionInitiated`
**resp#2** `ServerDisconnect: Disconnected`
resp#3 `ServerDisconnect: TransactionICompleted`

Your setup responds directly with the `ServerDisconnect: TransactionICompleted` (not expected resp #2) hence why the internal state machine believes its unexpected response.  On yourside, `rcp.c:216` and `rcp.267` comment out the `goto resp_err` so it drops trhough and tries looks at the terminating condition.

**Comment by whatdoineed2do** [comment]
One other note .. i've added `mdns` discovery so you can remove the `rcp "M2000 Office" { ... }` entry from the config file and it should find the Roku directly from the device's announcement

**Comment by frankusb** [comment]
With the two lines commented, it works every other time as it did before the change.

```
[2022-01-23 08:28:11] [ INFO]      rcp: Connection to 'M2000 Office' established
[2022-01-23 08:28:11] [DEBUG]      rcp: device cb 480785763 'M2000 Office'  callback 1
[2022-01-23 08:28:11] [DEBUG]      rcp: 480785763 state 0 recv'd 13 bytes 'roku: ready
[2022-01-23 08:28:11] [DEBUG]      rcp: 480785763 state 0   send 'SetPowerState on no'
[2022-01-23 08:28:11] [DEBUG]      rcp: 480785763 state 1 recv'd 1 bytes 'S'
[2022-01-23 08:28:11] [DEBUG]      rcp: 480785763 state 1 recv'd 18 bytes 'etPowerState: OK
[2022-01-23 08:28:11] [DEBUG]      rcp: 480785763 state 1   send 'GetConnectedServer'
[2022-01-23 08:28:11] [DEBUG]      rcp: 480785763 state 2 recv'd 34 bytes 'GetConnectedServer: GenericError
[2022-01-23 08:28:11] [DEBUG]      rcp: 480785763 state 2   send 'ServerDisconnect'
[2022-01-23 08:28:11] [DEBUG]      rcp: 480785763 state 3 recv'd 1 bytes 'S'
[2022-01-23 08:28:11] [DEBUG]      rcp: 480785763 state 3 recv'd 115 bytes 'erverDisconnect: TransactionInitiated
[2022-01-23 08:28:11] [ WARN]      rcp: Unexpected response (ServerDisconnect: TransactionComplete
[2022-01-23 08:28:11] [DEBUG]      rcp: session shutdown 480785763 M2000 Office at 192.168.1.40
[2022-01-23 08:28:11] [DEBUG]      rcp: 480785763 state 31   send 'SetPowerState standby'
[2022-01-23 08:28:11] [DEBUG]      rcp: session cleanup 480785763 M2000 Office at 192.168.1.40
[2022-01-23 08:28:11] [DEBUG]      rcp: session free 480785763 M2000 Office at 192.168.1.40
[2022-01-23 08:28:15] [DEBUG]      rcp: device start 480785763 'M2000 Office'
[2022-01-23 08:28:15] [DEBUG]      rcp: make session 480785763 M2000 Office at 192.168.1.40 initial vol=0
[2022-01-23 08:28:15] [ INFO]      rcp: Connection to 'M2000 Office' established
[2022-01-23 08:28:15] [DEBUG]      rcp: device cb 480785763 'M2000 Office'  callback 1
[2022-01-23 08:28:15] [DEBUG]      rcp: 480785763 state 0 recv'd 13 bytes 'roku: ready
[2022-01-23 08:28:15] [DEBUG]      rcp: 480785763 state 0   send 'SetPowerState on no'
[2022-01-23 08:28:15] [DEBUG]      rcp: 480785763 state 1 recv'd 1 bytes 'S'
[2022-01-23 08:28:15] [DEBUG]      rcp: 480785763 state 1 recv'd 7 bytes 'etPower'
[2022-01-23 08:28:15] [DEBUG]      rcp: 480785763 state 1 recv'd 7 bytes 'State: '
[2022-01-23 08:28:15] [DEBUG]      rcp: 480785763 state 1 recv'd 4 bytes 'OK
[2022-01-23 08:28:15] [DEBUG]      rcp: 480785763 state 1   send 'GetConnectedServer'
[2022-01-23 08:28:15] [DEBUG]      rcp: 480785763 state 2 recv'd 20 bytes 'GetConnectedServer: '
[2022-01-23 08:28:15] [DEBUG]      rcp: 480785763 state 2 recv'd 14 bytes 'GenericError
[2022-01-23 08:28:15] [DEBUG]      rcp: 480785763 state 2   send 'ServerDisconnect'
[2022-01-23 08:28:15] [DEBUG]      rcp: 480785763 state 3 recv'd 1 bytes 'S'
[2022-01-23 08:28:15] [DEBUG]      rcp: 480785763 state 3 recv'd 36 bytes 'erverDisconnect: ErrorDisconnected
[2022-01-23 08:28:15] [DEBUG]      rcp: 480785763 state 6   send 'SetServerFilter radio'
[2022-01-23 08:28:15] [DEBUG]      rcp: 480785763 state 7 recv'd 1 bytes 'S'
[2022-01-23 08:28:15] [DEBUG]      rcp: 480785763 state 7 recv'd 13 bytes 'etServerFilte'
[2022-01-23 08:28:15] [DEBUG]      rcp: 480785763 state 7 recv'd 7 bytes 'r: OK
[2022-01-23 08:28:15] [DEBUG]      rcp: 480785763 state 7   send 'ListServers'
[2022-01-23 08:28:15] [DEBUG]      rcp: 480785763 state 8 recv'd 1 bytes 'L'
[2022-01-23 08:28:15] [DEBUG]      rcp: 480785763 state 8 recv'd 7 bytes 'istServ'
[2022-01-23 08:28:15] [DEBUG]      rcp: 480785763 state 8 recv'd 5 bytes 'ers: '
[2022-01-23 08:28:15] [DEBUG]      rcp: 480785763 state 8 recv'd 5 bytes 'ListR'
[2022-01-23 08:28:15] [DEBUG]      rcp: 480785763 state 8 recv'd 6 bytes 'esultS'
[2022-01-23 08:28:15] [DEBUG]      rcp: 480785763 state 8 recv'd 7 bytes 'ize 1
[2022-01-23 08:28:15] [DEBUG]      rcp: 480785763 state 9 recv'd 6 bytes 'ListSe'
[2022-01-23 08:28:15] [DEBUG]      rcp: 480785763 state 9 recv'd 8 bytes 'rvers: I'
[2022-01-23 08:28:15] [DEBUG]      rcp: 480785763 state 9 recv'd 7 bytes 'nternet'
[2022-01-23 08:28:15] [DEBUG]      rcp: 480785763 state 9 recv'd 9 bytes ' Radio
[2022-01-23 08:28:15] [DEBUG]      rcp: 480785763 state 10 recv'd 11 bytes 'istServers:'
[2022-01-23 08:28:15] [DEBUG]      rcp: 480785763 state 10 recv'd 5 bytes ' List'
[2022-01-23 08:28:15] [DEBUG]      rcp: 480785763 state 10 recv'd 6 bytes 'Result'
[2022-01-23 08:28:15] [DEBUG]      rcp: 480785763 state 10 recv'd 5 bytes 'End
[2022-01-23 08:28:15] [DEBUG]      rcp: 480785763 state 11   send 'ServerConnect 0'
[2022-01-23 08:28:15] [DEBUG]      rcp: 480785763 state 12 recv'd 1 bytes 'S'
[2022-01-23 08:28:15] [DEBUG]      rcp: 480785763 state 12 recv'd 13 bytes 'erverConnect:'
[2022-01-23 08:28:15] [DEBUG]      rcp: 480785763 state 12 recv'd 16 bytes ' TransactionInit'
[2022-01-23 08:28:15] [DEBUG]      rcp: 480785763 state 12 recv'd 7 bytes 'iated
[2022-01-23 08:28:15] [DEBUG]      rcp: 480785763 state 13 recv'd 1 bytes 'S'
[2022-01-23 08:28:15] [DEBUG]      rcp: 480785763 state 13 recv'd 15 bytes 'erverConnect: C'
[2022-01-23 08:28:15] [DEBUG]      rcp: 480785763 state 13 recv'd 11 bytes 'onnected
[2022-01-23 08:28:15] [DEBUG]      rcp: 480785763 state 14 recv'd 12 bytes 'erverConnect'
[2022-01-23 08:28:15] [DEBUG]      rcp: 480785763 state 14 recv'd 7 bytes ': Trans'
[2022-01-23 08:28:15] [DEBUG]      rcp: 480785763 state 14 recv'd 9 bytes 'actionCom'
[2022-01-23 08:28:15] [DEBUG]      rcp: 480785763 state 14 recv'd 7 bytes 'plete
[2022-01-23 08:28:15] [DEBUG]      rcp: 480785763 state 15   send 'GetVolume'
[2022-01-23 08:28:15] [DEBUG]      rcp: 480785763 state 16 recv'd 1 bytes 'G'
[2022-01-23 08:28:15] [DEBUG]      rcp: 480785763 state 16 recv'd 14 bytes 'etVolume: 30
[2022-01-23 08:28:15] [DEBUG]      rcp: 480785763 state 16   send 'ClearWorkingSong'
[2022-01-23 08:28:15] [DEBUG]      rcp: 480785763 state 17 recv'd 1 bytes 'C'
[2022-01-23 08:28:15] [DEBUG]      rcp: 480785763 state 17 recv'd 10 bytes 'learWorkin'
[2022-01-23 08:28:15] [DEBUG]      rcp: 480785763 state 17 recv'd 11 bytes 'gSong: OK
[2022-01-23 08:28:15] [DEBUG]      rcp: 480785763 state 17   send 'SetWorkingSongInfo title OwnTone oberon stream'
[2022-01-23 08:28:15] [DEBUG]      rcp: 480785763 state 18 recv'd 1 bytes 'S'
[2022-01-23 08:28:15] [DEBUG]      rcp: 480785763 state 18 recv'd 16 bytes 'etWorkingSongInf'
[2022-01-23 08:28:15] [DEBUG]      rcp: 480785763 state 18 recv'd 7 bytes 'o: OK
[2022-01-23 08:28:15] [DEBUG]      rcp: 480785763 state 18   send 'SetWorkingSongInfo playlistURL http://192.168.1.119:3689/stream.mp3'
[2022-01-23 08:28:15] [DEBUG]      rcp: 480785763 state 19 recv'd 1 bytes 'S'
[2022-01-23 08:28:15] [DEBUG]      rcp: 480785763 state 19 recv'd 12 bytes 'etWorkingSon'
[2022-01-23 08:28:15] [DEBUG]      rcp: 480785763 state 19 recv'd 11 bytes 'gInfo: OK
[2022-01-23 08:28:15] [DEBUG]      rcp: 480785763 state 19   send 'SetWorkingSongInfo remoteStream 1'
[2022-01-23 08:28:15] [DEBUG]      rcp: 480785763 state 20 recv'd 1 bytes 'S'
[2022-01-23 08:28:15] [DEBUG]      rcp: 480785763 state 20 recv'd 23 bytes 'etWorkingSongInfo: OK
[2022-01-23 08:28:15] [DEBUG]      rcp: 480785763 state 20   send 'QueueAndPlayOne working'
[2022-01-23 08:28:15] [DEBUG]      rcp: 480785763 state 23 recv'd 1 bytes 'Q'
[2022-01-23 08:28:15] [DEBUG]      rcp: 480785763 state 23 recv'd 20 bytes 'ueueAndPlayOne: OK
[2022-01-23 08:28:19] [DEBUG]      rcp: device stop 480785763 'M2000 Office'
[2022-01-23 08:28:19] [DEBUG]      rcp: session shutdown 480785763 M2000 Office at 192.168.1.40
[2022-01-23 08:28:19] [DEBUG]      rcp: 480785763 state 24   send 'SetPowerState standby'
[2022-01-23 08:28:19] [DEBUG]      rcp: session cleanup 480785763 M2000 Office at 192.168.1.40
[2022-01-23 08:28:19] [DEBUG]      rcp: session free 480785763 M2000 Office at 192.168.1.40
[2022-01-23 08:28:20] [DEBUG]      rcp: device start 480785763 'M2000 Office'
[2022-01-23 08:28:20] [DEBUG]      rcp: make session 480785763 M2000 Office at 192.168.1.40 initial vol=0
[2022-01-23 08:28:20] [ INFO]      rcp: Connection to 'M2000 Office' established
[2022-01-23 08:28:20] [DEBUG]      rcp: device cb 480785763 'M2000 Office'  callback 1
[2022-01-23 08:28:20] [DEBUG]      rcp: 480785763 state 0 recv'd 13 bytes 'roku: ready
[2022-01-23 08:28:20] [DEBUG]      rcp: 480785763 state 0   send 'SetPowerState on no'
[2022-01-23 08:28:20] [DEBUG]      rcp: 480785763 state 1 recv'd 19 bytes 'SetPowerState: OK
[2022-01-23 08:28:20] [DEBUG]      rcp: 480785763 state 1   send 'GetConnectedServer'
[2022-01-23 08:28:20] [DEBUG]      rcp: 480785763 state 2 recv'd 23 bytes 'GetConnectedServer: Gen'
[2022-01-23 08:28:20] [DEBUG]      rcp: 480785763 state 2 recv'd 8 bytes 'ericErro'
[2022-01-23 08:28:20] [DEBUG]      rcp: 480785763 state 2 recv'd 3 bytes 'r
[2022-01-23 08:28:20] [DEBUG]      rcp: 480785763 state 2   send 'ServerDisconnect'
[2022-01-23 08:28:20] [DEBUG]      rcp: 480785763 state 3 recv'd 1 bytes 'S'
[2022-01-23 08:28:20] [DEBUG]      rcp: 480785763 state 3 recv'd 115 bytes 'erverDisconnect: TransactionInitiated
[2022-01-23 08:28:20] [ WARN]      rcp: Unexpected response (ServerDisconnect: TransactionComplete
[2022-01-23 08:28:20] [DEBUG]      rcp: session shutdown 480785763 M2000 Office at 192.168.1.40
[2022-01-23 08:28:20] [DEBUG]      rcp: 480785763 state 31   send 'SetPowerState standby'
[2022-01-23 08:28:20] [DEBUG]      rcp: session cleanup 480785763 M2000 Office at 192.168.1.40
[2022-01-23 08:28:20] [DEBUG]      rcp: session free 480785763 M2000 Office at 192.168.1.40
```

**Comment by whatdoineed2do** [comment]
I think I've closed out most of the items (at least that i can see on my roku/setup - if you see any odd unexpect response issues let me know) so if you could give this another go it would be good.

The nuance of forcing the server into _internet radio_ mode is that it when you re-power your device, it will try again to connect to the owntone server.  i havent looked into whether i can get the current state to persist and to restore.

Other thing I think i've fixed is the rokus will show up as unselected in the speaker list so you are forced to click them to pwoer them on and thsu be selectable.  On first build of this, you'll still see them in the speaker list as "active" but just click them twice and after that this should be work the way we expect.

On owntone shutdown, it will also try to force the rokus into standby mode (as is the case when an error occurs i think)

**Comment by frankusb** [comment]
Solid. No Soundbridge issues to report.

I've still got some kind of /etc/hosts interaction. My Debian node is unable to resolve oberon.local now (or other .locals on the network).

**Comment by frankusb** [comment]
Maybe I'm misremembering and the Debian node has always failed to resolve owntone.local or oberon.local. It is able to resolve other .local hosts, there is a longer pause that what I expect but it is working. Oddly, loading oberon.local in Chrome works but not owntone.local. I thought I fixed all of this at one point but I can't get it to work currently.

If there was another way for owntone to resolve the ip it seems that would help other Debian default installs that will have the entry in hosts.

**Comment by whatdoineed2do** [comment]
That's probably something to do with avahi pub / announcing something 

The stock owntone announces owntone.local but not hostage.local AFAIK. avahi-broswe -avt should tell you wants announcing on your metwork

**Comment by frankusb** [comment]
Is this what should be expected?

```
avahi-browse -avt | grep -i owntone
Server version: avahi 0.8; Host name: oberon.local
E Ifce Prot Name                                          Type                 Domain
```

```
avahi-browse -avt | grep -i oberon
Server version: avahi 0.8; Host name: oberon.local
E Ifce Prot Name                                          Type                 Domain
+ enp1s0 IPv6 OBERON                                        Device Info          local
+ enp1s0 IPv4 OBERON                                        Device Info          local
+     lo IPv4 OBERON                                        Device Info          local
+ enp1s0 IPv6 My Music on oberon                            Music Player Daemon  local
+ enp1s0 IPv4 My Music on oberon                            Music Player Daemon  local
+     lo IPv4 My Music on oberon                            Music Player Daemon  local
+ enp1s0 IPv6 My Music on oberon                            iTunes Audio Access  local
+ enp1s0 IPv4 My Music on oberon                            iTunes Audio Access  local
+     lo IPv4 My Music on oberon                            iTunes Audio Access  local
+ enp1s0 IPv6 My Music on oberon                            _rsp._tcp            local
+ enp1s0 IPv4 My Music on oberon                            _rsp._tcp            local
+     lo IPv4 My Music on oberon                            _rsp._tcp            local
+ enp1s0 IPv6 My Music on oberon                            Web Site             local
+ enp1s0 IPv4 My Music on oberon                            Web Site             local
+     lo IPv4 My Music on oberon                            Web Site             local
+ enp1s0 IPv6 OBERON                                        Microsoft Windows Network local
+ enp1s0 IPv4 OBERON                                        Microsoft Windows Network local
+     lo IPv4 OBERON                                        Microsoft Windows Network local
```

**Comment by frankusb** [comment]
After using Owntone RCP, later I tried to use the Soundbridge remote to play some music from Owntone RSP. When I powered on the Soundbridge, it immediately tried to connect to the owntone stream that was not present. I had to wait for it to timeout before I could get control with the remote.

I checked and I don't think you are performing a ServerDisconnect before power off. I think if you added this, it would allow users to use either Owntone or the Soundbridge remote without the timeout of trying to reconnect to a non existent stream.

**Comment by whatdoineed2do** [comment]
Thanks for the note.

At `rcp.c:678`, if you add `rcp_send(s, RCP_STATE_STOPPED, "ServerDisconnect");` (just above the `SetPowerState ...`) does this resolve the rpboelm?  this was something  i mentioned that before that i didnt find a way to determine prevous "_connected server_ to reinstate.

So yes, if this additional `ServerDisconnect` solves this, we should go wtih this:  can you make that one line change and test?

**Comment by whatdoineed2do** [comment]
tested this and it sending `ServerDisconnect` and then retrying cause the roku to respond with `ResourceAllocationError` which blocks subsequent connections.  I also tried `ClearWorkingSong` as well as `Stop` but powering on the roku (with remote) still had it connect to the mp3 stream.

Remind me.. when you play library etc and power off and back on again, does the roku always go back to it?  or can you set it into a "forget everything state"?

In my setup, i've done this:
* power up M1000
* use owntone webui to enable speaker
* use owntone to play some music files
* use owntone webui to disable speaker
* kill owntone server
* power up M1000, tires to connect to OwnTone mp3 stream
* use roku remote, press "menu" and page down to "Change Library Configuration"

I dont get any lockup.  The reason i mention this is because i remember that the soundbridge will always try the last thing (library or stream) it was connected to even if its not there but it doesnt stop users from changing via the physical remote.

As mentioend, I haven't found how to determine the Roku's last library / connected server (its state) upon initial connection so i can try to reset it to this state when i tear down the connection (speaker deselect).  but this "use the last connection/library upon power on" appears to be by roku design.

**Comment by frankusb** [comment]
> Remind me.. when you play library etc and power off and back on again, does the roku always go back to it? or can you set it into a "forget everything state"?

There is no setting that I am aware of. AFAIK it will always connect to the previous "music library". With UPNP/DAAP/RSP it puts you at the top of the browse tree. With Internet Radio it connects to the last connected stream.  The only time I've seen it at the library selection menu is if it gets a notification from a UPNP/DAAP/RSP library that the library is closing, which is why I assumed it's possible.


> * power up M1000, tires to connect to OwnTone mp3 stream
> * use roku remote, press "menu" and page down to "Change Library Configuration"

When selecting "Change Library Configuration", I informally timed it with a 7 second delay until the button press had a response and the list of libraries was shown.

**Comment by frankusb** [comment]
Page 103 of the RCP specification states: "To make sure that no one in the system is connected to a server, first call
GetConnectedServer, and then call ServerDisconnect.". I'll give that a try.

**Comment by whatdoineed2do** [comment]
> Page 103 of the RCP specification states: "To make sure that no one in the system is connected to a server, first call GetConnectedServer, and then call ServerDisconnect.". I'll give that a try.

Did this, next connect using the spec's prescribed methods gets us into a "resource allocation error" response that needs a hard reboot of the roku.

Seems like no way to get the roku to be in a unconnected state when powering own, unless you can experiment and find one.

You can use the `telnet <address> 5555` and issue the text commands that the rcp code sends and see if you can find a way that;d be great

**Comment by frankusb** [comment]
This worked for me at the telnet interface. Powering up after the below sequence had the Soundbridge at the Library selection menu. I will try to modify the code to do similar and see what happens.

```
SetPowerState on no
SetPowerState: OK
GetConnectedServer
GetConnectedServer: GenericError
ServerDisconnect
ServerDisconnect: TransactionInitiated
ServerDisconnect: ErrorDisconnected
ServerDisconnect: TransactionComplete
SetServerFilter radio
SetServerFilter: OK
ListServers
ListServers: ListResultSize 1
ListServers: Internet Radio
ListServers: ListResultEnd
ServerConnect 0
ServerConnect: TransactionInitiated
ServerConnect: Connected
ServerConnect: TransactionComplete
ClearWorkingSong
ClearWorkingSong: OK
SetWorkingSongInfo title OwnTone oberon stream
SetWorkingSongInfo: OK
SetWorkingSongInfo playlistURL http://legacy.radioparadise.com/m3u/mp3-128.m3u
SetWorkingSongInfo: OK
SetWorkingSongInfo remoteStream 1
SetWorkingSongInfo: OK
QueueAndPlayOne working
QueueAndPlayOne: OK
Stop
Stop: OK
GetConnectedServer
GetConnectedServer: OK
ServerDisconnect
ServerDisconnect: TransactionInitiated
ServerDisconnect: Disconnected
ServerDisconnect: TransactionComplete
SetPowerState standby
SetPowerState: OK
```

**Comment by frankusb** [comment]
The below test worked for me. I realize states need to be added but I wanted to confirm my telnet experiment programatically.

```
void
rcp_disconnect(int fd)
{
  /* no more receptions */
  shutdown(fd, SHUT_RDWR);
  close(fd);
}

void
rcp_session_shutdown(struct rcp_session* s, enum rcp_state state)
{
  DPRINTF(E_DBG, L_RCP, "session shutdown %ld %s at %s\n", s->device->id, s->devname, s->address);

  /* dont send STOP (since we will need to accept/read the roku response before
   * allow subsequent commands) - just put the remote roku in standby 
   */
  
  rcp_send(s, RCP_STATE_STOPPED, "Stop");
  sleep(3);
  rcp_send(s, RCP_STATE_STOPPED, "GetConnectedServer");
  sleep(3);
  rcp_send(s, RCP_STATE_STOPPED, "ServerDisconnect");
  sleep(3);
  
  rcp_send(s, RCP_STATE_STOPPED, "SetPowerState standby");
  sleep(3);
  rcp_disconnect(s->sock);
  s->sock = -1;

  // we've shutdown, ensure state is valid
  switch (state)
  {
    case RCP_STATE_STOPPED ... RCP_STATE_FAILED:
      break;

    default:
      state = RCP_STATE_FAILED;
  }
  s->state = state;
  rcp_status(s);
}
```

**Comment by frankusb** [comment]
I think the key is the `ServerDisconnect` command, experimenting with telnet, `ServerDisconnect: TransactionInitiated` comes back immediately but 

```
ServerDisconnect: Disconnected
ServerDisconnect: TransactionComplete
```

takes several seconds.

**Comment by frankusb** [comment]
I added states and removed the sleeps and it continues to work. I'm getting a bunch of "Streaming pipe full, skipping write" on subsequent uses though so I don't have it quite right. But the messages to get sent and the Soundbridge powers on the next time and does not try to reconnect.

**Comment by whatdoineed2do** [comment]
> "Streaming pipe full, skipping write" on subsequent uses though so I don't have it quite right

This prob means the data for the mp3 is being generated but not being read by the remote side (ie the Roku).  This probably means the RCP commands that have been sent have put it in a locked up state.

I'll take a look at the shutdown commands you describe over the wkend.  We can't have the sleeps there so if its really waiting for some internal state to be reached on the roku before it sends owntone a reply, we need to read those replies and then send next command which is tricky given the libevent loop is processing the response..

**Comment by frankusb** [comment]
Oh, probably because I am not updating the state to the player soon enough.

**Comment by frankusb** [comment]
Oh dang, once you tell it you're stopped you stop getting callbacks. I see the tricky part.

**Comment by frankusb** [comment]
> This prob means the data for the mp3 is being generated but not being read by the remote side (ie the Roku). This probably means the RCP commands that have been sent have put it in a locked up state.

The first command issued is Stop so that would end reading of the mp3 stream.

**Comment by frankusb** [comment]
Is it possible to transition from OUTPUT_STATE_STREAMING to OUTPUT_STATE_CONNECTED during shutdown? Then finally OUTPUT_STATE_STOPPED. I will give this a try.

**Comment by frankusb** [comment]
This works! No more pipe warnings.

**Comment by whatdoineed2do** [comment]
@frankusb - i've had an attempt to add the shutdown handling that you describe but in the state machine (no sleep(10) etc).  Ive wrapped this as a cfg driven item (since its forcing the server to do extra work during its teardown where it may not make sense to have additional chatter with a remote device, even though there's a timeout on respnse).

CAn you take the lastest upds to the branch (save your changes somewhere) and let me know if it works they way you expect.  Not at home with my own device but tested against my test harness.

You will need to add back to your cfg:
```
rcp "M2000 Offfice" {
    clear_on_close = true
}
```
Therse 2x changes, one that is lesser of an issue but it handles non responses from roku when setting up.

**Comment by frankusb** [comment]
My current state machine does not have any sleeps in it. I change the state from OUTPUT_STATE_STREAMING to OUTPUT_STATE_CONNECTED and then do the shut down using the existing state machine. When it makes it to SetPowerState then I change to OUTPUT_STATE_STOPPED.

I will test your version.

**Comment by frankusb** [comment]
It's not working for me.

[2022-01-28 17:01:08] [DEBUG]      rcp: 480785763 state 20   send 'QueueAndPlayOne working'
[2022-01-28 17:01:09] [DEBUG]      rcp: 480785763 state 23 recv'd 1 bytes 'Q'
[2022-01-28 17:01:09] [DEBUG]      rcp: 480785763 state 23 recv'd 20 bytes 'ueueAndPlayOne: OK
[2022-01-28 17:01:09] [ INFO]      rcp: Ready 'M2000 Office' volume at 30'
[2022-01-28 17:01:15] [DEBUG]      rcp: device stop 480785763 'M2000 Office'
[2022-01-28 17:01:15] [DEBUG]      rcp: session shutdown 480785763 M2000 Office at 192.168.1.40
[2022-01-28 17:01:15] [ INFO]      rcp: Clearing on shutdown 'M2000 Office' at 192.168.1.40
[2022-01-28 17:01:15] [DEBUG]      rcp: 480785763 state 24   send 'Stop'
[2022-01-28 17:01:25] [ WARN]      rcp: Timed out waiting on shutdown response 'M2000 Office' at 192.168.1.40, disconnecting
[2022-01-28 17:01:25] [DEBUG]      rcp: session cleanup 480785763 M2000 Office at 192.168.1.40
[2022-01-28 17:01:25] [DEBUG]      rcp: session free 480785763 M2000 Office at 192.168.1.40

See the attached for what's working for me.
[rcp.c.zip](https://github.com/owntone/owntone-server/files/7962357/rcp.c.zip)

**Comment by whatdoineed2do** [comment]
You showed this sequence that worked in telnet

SetWorkingSongInfo: OK
QueueAndPlayOne working
QueueAndPlayOne: OK
Stop
Stop: OK
GetConnectedServer
GetConnectedServer: OK
ServerDisconnect
ServerDisconnect: TransactionInitiated
ServerDisconnect: Disconnected
ServerDisconnect: TransactionComplete
SetPowerState standby
SetPowerState: OK

The code is trying the same but apparently your roku  doesn't respond within 10seconds.  Did you notice such a delay in getting back a stop OK on the telnet session?

In the rcp_sezsion_shutdown_clear((), does changing the timeout { 10, 0 } to something much larger like 3600, 0 make it work? If it does how long does it take roku to respond?

**Comment by frankusb** [comment]
The Stop command never took any time either with telnet or my implementation. From the log I don't see a difference. The longest command I saw with telnet was ServerDisconnect and that was less then 5 seconds.

I think maybe Wireshark might show something. I will probably give that a look tomorrow.

**Comment by whatdoineed2do** [comment]
I tried thi on my M1000 and it works as expected when owntone is not playing a track / streaming data.

```
[2022-01-29 13:39:22] [DEBUG]      rcp: 3398484753 state 20   send 'QueueAndPlayOne working'
[2022-01-29 13:39:22] [DEBUG]      rcp: 3398484753 state 23 recv'd 1 bytes 'Q'
[2022-01-29 13:39:22] [DEBUG]      rcp: 3398484753 state 23 recv'd 20 bytes 'ueueAndPlayOne: OK
'
[2022-01-29 13:39:22] [ INFO]      rcp: Ready 'SoundBridge' volume at 95'

[2022-01-29 13:39:36] [DEBUG]      rcp: device stop 3398484753 'SoundBridge'
[2022-01-29 13:39:36] [DEBUG]      rcp: session shutdown 3398484753 SoundBridge at 192.168.0.3
[2022-01-29 13:39:36] [ INFO]      rcp: Clearing on shutdown 'SoundBridge' at 192.168.0.3
[2022-01-29 13:39:36] [DEBUG]      rcp: 3398484753 state 24   send 'Stop'
[2022-01-29 13:39:45] [DEBUG]      rcp: 3398484753 state 28 recv'd 1 bytes 'S'
[2022-01-29 13:39:45] [DEBUG]      rcp: 3398484753 state 28 recv'd 9 bytes 'top: OK
'
[2022-01-29 13:39:45] [DEBUG]      rcp: processing 'Stop: OK
'
[2022-01-29 13:39:45] [DEBUG]      rcp: 3398484753 state 28   send 'GetConnectedServer'
[2022-01-29 13:39:45] [DEBUG]      rcp: 3398484753 state 29 recv'd 1 bytes 'G'
[2022-01-29 13:39:45] [DEBUG]      rcp: 3398484753 state 29 recv'd 23 bytes 'etConnectedServer: OK
'
[2022-01-29 13:39:45] [DEBUG]      rcp: processing 'GetConnectedServer: OK
'
[2022-01-29 13:39:45] [DEBUG]      rcp: 3398484753 state 29   send 'ServerDisconnect'
[2022-01-29 13:39:45] [DEBUG]      rcp: 3398484753 state 30 recv'd 1 bytes 'S'
[2022-01-29 13:39:45] [DEBUG]      rcp: 3398484753 state 30 recv'd 35 bytes 'erverDisconnect: TransactionInitiat'
[2022-01-29 13:39:45] [DEBUG]      rcp: 3398484753 state 30 recv'd 4 bytes 'ed
'
[2022-01-29 13:39:45] [DEBUG]      rcp: processing 'ServerDisconnect: TransactionInitiated
'
[2022-01-29 13:39:46] [DEBUG]      rcp: 3398484753 state 31 recv'd 1 bytes 'S'
[2022-01-29 13:39:46] [DEBUG]      rcp: 3398484753 state 31 recv'd 70 bytes 'erverDisconnect: Disconnected
ServerDisconnect: TransactionComplete
'
[2022-01-29 13:39:46] [DEBUG]      rcp: processing 'ServerDisconnect: Disconnected
'
[2022-01-29 13:39:46] [DEBUG]      rcp: processing 'ServerDisconnect: TransactionComplete
'
[2022-01-29 13:39:46] [DEBUG]      rcp: All clear cmds sent to 'SoundBridge' at 192.168.0.3
[2022-01-29 13:39:46] [DEBUG]      rcp: 3398484753 state 33   send 'SetPowerState standby'
[2022-01-29 13:39:46] [DEBUG]      rcp: session cleanup 3398484753 SoundBridge at 192.168.0.3
[2022-01-29 13:39:46] [DEBUG]      rcp: session free 3398484753 SoundBridge at 192.168.0.3
```

But i also get a timeout when stop the roku when a strream is playing near end of the track or transitioning into the next track (with the current 10s) timeout.  if i up the timeout to 3600 and disable the stream, what i notice is that the Roku WILL shtudown as we expect BUT perhaps after the player has finished working on particular track - notice that Stop response is recieved about ~12 after we ask roku to stop.

```
[2022-01-29 13:45:52] [ INFO]      rcp: Ready 'SoundBridge' volume at 95'

[2022-01-29 13:46:04] [DEBUG]      rcp: device stop 3398484753 'SoundBridge'
[2022-01-29 13:46:04] [DEBUG]      rcp: session shutdown 3398484753 SoundBridge at 192.168.0.3
[2022-01-29 13:46:04] [ INFO]      rcp: Clearing on shutdown 'SoundBridge' at 192.168.0.3
[2022-01-29 13:46:04] [DEBUG]      rcp: 3398484753 state 24   send 'Stop'
[2022-01-29 13:46:16] [DEBUG]      rcp: 3398484753 state 28 recv'd 1 bytes 'S'
[2022-01-29 13:46:16] [DEBUG]      rcp: 3398484753 state 28 recv'd 9 bytes 'top: OK
'
[2022-01-29 13:46:16] [DEBUG]      rcp: processing 'Stop: OK
'
```
What i havent quite figured out is whether this is a delay at the Roku (for which the only thing we can do is increase the timeout response) or its the libevent loop for the player/event_base i'm attaching the events to.

I'll up the default timeout limit to 15s, add a confiugration item but as far as i can see its working.  this `clear on close` is a nice t have (as it generates more chatter to the roku even when we're trying to kill the session).

**Comment by frankusb** [comment]
I checked Wireshark this morning and I don't see why the delay is happening. I did go back and verify my implementation works as I remember. The delay is not at the Roku below.

```
[2022-01-29 08:22:21] [DEBUG]      rcp: device start 480785763 'M2000 Office'
[2022-01-29 08:22:21] [DEBUG]      rcp: make session 480785763 M2000 Office at 192.168.1.40 initial vol=0
[2022-01-29 08:22:21] [ INFO]      rcp: Connection to 'M2000 Office' established
[2022-01-29 08:22:21] [DEBUG]      rcp: device cb 480785763 'M2000 Office'  callback 0
[2022-01-29 08:22:21] [DEBUG]      rcp: 480785763 state 0 recv'd 1 bytes 'r'
[2022-01-29 08:22:21] [DEBUG]      rcp: 480785763 state 0 recv'd 12 bytes 'oku: ready
[2022-01-29 08:22:21] [DEBUG]      rcp: 480785763 state 0   send 'SetPowerState on no'
[2022-01-29 08:22:21] [DEBUG]      rcp: 480785763 state 1 recv'd 1 bytes 'S'
[2022-01-29 08:22:21] [DEBUG]      rcp: 480785763 state 1 recv'd 8 bytes 'etPowerS'
[2022-01-29 08:22:21] [DEBUG]      rcp: 480785763 state 1 recv'd 7 bytes 'tate: O'
[2022-01-29 08:22:21] [DEBUG]      rcp: 480785763 state 1 recv'd 3 bytes 'K
[2022-01-29 08:22:21] [DEBUG]      rcp: 480785763 state 1   send 'GetConnectedServer'
[2022-01-29 08:22:21] [DEBUG]      rcp: 480785763 state 2 recv'd 17 bytes 'GetConnectedServe'
[2022-01-29 08:22:21] [DEBUG]      rcp: 480785763 state 2 recv'd 7 bytes 'r: OK
[2022-01-29 08:22:21] [DEBUG]      rcp: 480785763 state 2   send 'ServerDisconnect'
[2022-01-29 08:22:21] [DEBUG]      rcp: 480785763 state 3 recv'd 1 bytes 'S'
[2022-01-29 08:22:21] [DEBUG]      rcp: 480785763 state 3 recv'd 20 bytes 'erverDisconnect: Tra'
[2022-01-29 08:22:21] [DEBUG]      rcp: 480785763 state 3 recv'd 12 bytes 'nsactionInit'
[2022-01-29 08:22:21] [DEBUG]      rcp: 480785763 state 3 recv'd 7 bytes 'iated
[2022-01-29 08:22:21] [DEBUG]      rcp: 480785763 state 4 recv'd 1 bytes 'S'
[2022-01-29 08:22:21] [DEBUG]      rcp: 480785763 state 4 recv'd 11 bytes 'erverDiscon'
[2022-01-29 08:22:21] [DEBUG]      rcp: 480785763 state 4 recv'd 30 bytes 'nect: Disconnected
[2022-01-29 08:22:21] [DEBUG]      rcp: 480785763 state 5 recv'd 11 bytes 'onnect: Tra'
'2022-01-29 08:22:21] [DEBUG]      rcp: 480785763 state 5 recv'd 17 bytes 'nsactionComplete
[2022-01-29 08:22:21] [DEBUG]      rcp: 480785763 state 5 recv'd 1 bytes '
[2022-01-29 08:22:21] [DEBUG]      rcp: 480785763 state 6   send 'SetServerFilter radio'
[2022-01-29 08:22:21] [DEBUG]      rcp: 480785763 state 7 recv'd 1 bytes 'S'
[2022-01-29 08:22:21] [DEBUG]      rcp: 480785763 state 7 recv'd 20 bytes 'etServerFilter: OK
[2022-01-29 08:22:21] [DEBUG]      rcp: 480785763 state 7   send 'ListServers'
[2022-01-29 08:22:21] [DEBUG]      rcp: 480785763 state 8 recv'd 1 bytes 'L'
[2022-01-29 08:22:21] [DEBUG]      rcp: 480785763 state 8 recv'd 87 bytes 'istServers: ListResultSize 1
[2022-01-29 08:22:21] [DEBUG]      rcp: 480785763 state 11   send 'ServerConnect 0'
[2022-01-29 08:22:21] [DEBUG]      rcp: 480785763 state 12 recv'd 1 bytes 'S'
[2022-01-29 08:22:21] [DEBUG]      rcp: 480785763 state 12 recv'd 10 bytes 'erverConne'
[2022-01-29 08:22:21] [DEBUG]      rcp: 480785763 state 12 recv'd 9 bytes 'ct: Trans'
[2022-01-29 08:22:21] [DEBUG]      rcp: 480785763 state 12 recv'd 7 bytes 'actionI'
[2022-01-29 08:22:21] [DEBUG]      rcp: 480785763 state 12 recv'd 6 bytes 'nitiat'
[2022-01-29 08:22:21] [DEBUG]      rcp: 480785763 state 12 recv'd 4 bytes 'ed
[2022-01-29 08:22:21] [DEBUG]      rcp: 480785763 state 13 recv'd 1 bytes 'S'
[2022-01-29 08:22:21] [DEBUG]      rcp: 480785763 state 13 recv'd 22 bytes 'erverConnect: Connecte'
[2022-01-29 08:22:21] [DEBUG]      rcp: 480785763 state 13 recv'd 13 bytes 'd
[2022-01-29 08:22:21] [DEBUG]      rcp: 480785763 state 14 recv'd 11 bytes 'ect: Transa'
[2022-01-29 08:22:21] [DEBUG]      rcp: 480785763 state 14 recv'd 11 bytes 'ctionComple'
[2022-01-29 08:22:21] [DEBUG]      rcp: 480785763 state 14 recv'd 4 bytes 'te
[2022-01-29 08:22:21] [DEBUG]      rcp: 480785763 state 15   send 'GetVolume'
[2022-01-29 08:22:21] [DEBUG]      rcp: 480785763 state 16 recv'd 1 bytes 'G'
[2022-01-29 08:22:21] [DEBUG]      rcp: 480785763 state 16 recv'd 9 bytes 'etVolume:'
[2022-01-29 08:22:21] [DEBUG]      rcp: 480785763 state 16 recv'd 5 bytes ' 30
[2022-01-29 08:22:21] [DEBUG]      rcp: 480785763 state 16   send 'ClearWorkingSong'
[2022-01-29 08:22:21] [DEBUG]      rcp: 480785763 state 17 recv'd 1 bytes 'C'
[2022-01-29 08:22:21] [DEBUG]      rcp: 480785763 state 17 recv'd 9 bytes 'learWorki'
[2022-01-29 08:22:21] [DEBUG]      rcp: 480785763 state 17 recv'd 9 bytes 'ngSong: O'
[2022-01-29 08:22:21] [DEBUG]      rcp: 480785763 state 17 recv'd 3 bytes 'K
[2022-01-29 08:22:21] [DEBUG]      rcp: 480785763 state 17   send 'SetWorkingSongInfo title OwnTone oberon stream'
[2022-01-29 08:22:21] [DEBUG]      rcp: 480785763 state 18 recv'd 1 bytes 'S'
[2022-01-29 08:22:21] [DEBUG]      rcp: 480785763 state 18 recv'd 23 bytes 'etWorkingSongInfo: OK
[2022-01-29 08:22:21] [DEBUG]      rcp: 480785763 state 18   send 'SetWorkingSongInfo playlistURL http://192.168.1.88:3689/stream.mp3'
[2022-01-29 08:22:21] [DEBUG]      rcp: 480785763 state 19 recv'd 1 bytes 'S'
[2022-01-29 08:22:21] [DEBUG]      rcp: 480785763 state 19 recv'd 8 bytes 'etWorkin'
[2022-01-29 08:22:21] [DEBUG]      rcp: 480785763 state 19 recv'd 15 bytes 'gSongInfo: OK
[2022-01-29 08:22:21] [DEBUG]      rcp: 480785763 state 19   send 'SetWorkingSongInfo remoteStream 1'
[2022-01-29 08:22:21] [DEBUG]      rcp: 480785763 state 20 recv'd 1 bytes 'S'
[2022-01-29 08:22:21] [DEBUG]      rcp: 480785763 state 20 recv'd 11 bytes 'etWorkingSo'
[2022-01-29 08:22:21] [DEBUG]      rcp: 480785763 state 20 recv'd 9 bytes 'ngInfo: O'
[2022-01-29 08:22:21] [DEBUG]      rcp: 480785763 state 20 recv'd 3 bytes 'K
[2022-01-29 08:22:21] [DEBUG]      rcp: 480785763 state 20   send 'QueueAndPlayOne working'
[2022-01-29 08:22:21] [DEBUG]      rcp: 480785763 state 23 recv'd 1 bytes 'Q'
[2022-01-29 08:22:21] [DEBUG]      rcp: 480785763 state 23 recv'd 16 bytes 'ueueAndPlayOne: '
[2022-01-29 08:22:21] [DEBUG]      rcp: 480785763 state 23 recv'd 4 bytes 'OK
[2022-01-29 08:22:21] [ INFO]      rcp: Ready 'M2000 Office' volume at 30'
[2022-01-29 08:22:27] [DEBUG]      rcp: device stop 480785763 'M2000 Office'
[2022-01-29 08:22:27] [DEBUG]      rcp: session shutdown 480785763 M2000 Office at 192.168.1.40
[2022-01-29 08:22:27] [DEBUG]      rcp: 480785763 state 24   send 'Stop'
[2022-01-29 08:22:27] [DEBUG]      rcp: 480785763 state 28 recv'd 1 bytes 'S'
[2022-01-29 08:22:27] [DEBUG]      rcp: 480785763 state 28 recv'd 9 bytes 'top: OK
[2022-01-29 08:22:27] [DEBUG]      rcp: 480785763 state 28   send 'GetConnectedServer'
[2022-01-29 08:22:27] [DEBUG]      rcp: 480785763 state 29 recv'd 1 bytes 'G'
[2022-01-29 08:22:27] [DEBUG]      rcp: 480785763 state 29 recv'd 23 bytes 'etConnectedServer: OK
[2022-01-29 08:22:27] [DEBUG]      rcp: 480785763 state 29   send 'ServerDisconnect'
[2022-01-29 08:22:27] [DEBUG]      rcp: 480785763 state 30 recv'd 1 bytes 'S'
[2022-01-29 08:22:27] [DEBUG]      rcp: 480785763 state 30 recv'd 8 bytes 'erverDis'
[2022-01-29 08:22:27] [DEBUG]      rcp: 480785763 state 30 recv'd 7 bytes 'connect'
[2022-01-29 08:22:27] [DEBUG]      rcp: 480785763 state 30 recv'd 8 bytes ': Transa'
[2022-01-29 08:22:27] [DEBUG]      rcp: 480785763 state 30 recv'd 6 bytes 'ctionI'
[2022-01-29 08:22:27] [DEBUG]      rcp: 480785763 state 30 recv'd 6 bytes 'nitiat'
[2022-01-29 08:22:27] [DEBUG]      rcp: 480785763 state 30 recv'd 4 bytes 'ed
[2022-01-29 08:22:27] [DEBUG]      rcp: 480785763 state 31 recv'd 1 bytes 'S'
[2022-01-29 08:22:27] [DEBUG]      rcp: 480785763 state 31 recv'd 8 bytes 'erverDis'
[2022-01-29 08:22:27] [DEBUG]      rcp: 480785763 state 31 recv'd 6 bytes 'connec'
[2022-01-29 08:22:27] [DEBUG]      rcp: 480785763 state 31 recv'd 7 bytes 't: Disc'
[2022-01-29 08:22:27] [DEBUG]      rcp: 480785763 state 31 recv'd 8 bytes 'onnected'
[2022-01-29 08:22:27] [DEBUG]      rcp: 480785763 state 31 recv'd 6 bytes '
[2022-01-29 08:22:27] [DEBUG]      rcp: 480785763 state 32 recv'd 9 bytes 'erDisconn'
[2022-01-29 08:22:27] [DEBUG]      rcp: 480785763 state 32 recv'd 8 bytes 'ect: Tra'
[2022-01-29 08:22:27] [DEBUG]      rcp: 480785763 state 32 recv'd 8 bytes 'nsaction'
[2022-01-29 08:22:27] [DEBUG]      rcp: 480785763 state 32 recv'd 10 bytes 'Complete
[2022-01-29 08:22:27] [DEBUG]      rcp: 480785763 state 33   send 'SetPowerState standby'
[2022-01-29 08:22:27] [DEBUG]      rcp: 480785763 state 34 recv'd 1 bytes 'S'
[2022-01-29 08:22:27] [DEBUG]      rcp: 480785763 state 34 recv'd 15 bytes 'etPowerState: O'
[2022-01-29 08:22:27] [DEBUG]      rcp: 480785763 state 34 recv'd 3 bytes 'K
[2022-01-29 08:22:27] [DEBUG]      rcp: session shutdown finish 480785763 M2000 Office at 192.168.1.40
[2022-01-29 08:22:27] [DEBUG]      rcp: session cleanup 480785763 M2000 Office at 192.168.1.40
[2022-01-29 08:22:27] [DEBUG]      rcp: session free 480785763 M2000 Office at 192.168.1.40
[2022-01-29 08:22:27] [DEBUG]      rcp: 480785763 state 0   send 'SetPowerState on no'
[2022-01-29 08:22:27] [  LOG]      rcp: Ignoring send request on , state = 0
```

**Comment by frankusb** [comment]
Here are the two Wireshark captures but I can't see a difference that explains the behavior.

[failed.zip](https://github.com/owntone/owntone-server/files/7963903/failed.zip)
[working.zip](https://github.com/owntone/owntone-server/files/7963904/working.zip)

**Comment by whatdoineed2do** [comment]
> I checked Wireshark this morning and I don't see why the delay is happening. I did go back and verify my implementation works as I remember. The delay is not at the Roku below.

when i say above it could be the event loop (`evbase_player`), scratch that ... at the point I saw in my code the delay happens in getting reply to `Stop` its at the point where i've unregistered the event/cb and using the system call `select()`on the roku socket to notify me when a response is there data.  this is what we also see in your `failed` pcap, or at least what the data shows before the capture was stopped.

`tcpdump -r failed.pcapng -s0 -X tcp and port 5555` i see a `Stop\r\n `(pkt seq 318) (hex `5374 6f70 0d0a`) from 1.88 -> 1.40 but not a response.
```
14:17:14.555845 IP (tos 0x0, ttl 255, id 2481, offset 0, flags [none], proto TCP (6), length 40)
    192.168.1.40.18142 > 192.168.1.88.daap: Flags [.], cksum 0x3b79 (correct), ack 182138, win 7656, length 0
        0x0000:  4500 0028 09b1 0000 ff06 2e4e c0a8 0128  E..(.......N...(
        0x0010:  c0a8 0158 46de 0e69 00c1 bec2 ff11 bec5  ...XF..i........
        0x0020:  5010 1de8 3b79 0000 504f 5354 202f       P...;y..POST./
14:17:14.556173 IP (tos 0x0, ttl 255, id 2482, offset 0, flags [none], proto TCP (6), length 40)
    192.168.1.40.18142 > 192.168.1.88.daap: Flags [.], cksum 0x3961 (correct), ack 182647, win 7683, length 0
        0x0000:  4500 0028 09b2 0000 ff06 2e4d c0a8 0128  E..(.......M...(
        0x0010:  c0a8 0158 46de 0e69 00c1 bec2 ff11 c0c2  ...XF..i........
        0x0020:  5010 1e03 3961 0000 3c72 6571 7565       P...9a..<reque
14:17:14.565546 IP (tos 0x0, ttl 64, id 6656, offset 0, flags [DF], proto TCP (6), length 46)
    192.168.1.88.55278 > 192.168.1.40.personal-agent: Flags [P.], cksum 0x83f1 (incorrect -> 0xcc81), seq 318:324, ack 521, win 64058, length 6
        0x0000:  4500 002e 1a00 4000 4006 9cf9 c0a8 0158  E.....@.@......X
        0x0010:  c0a8 0128 d7ee 15b3 beb8 b9ea 00ae 2e57  ...(...........W
        0x0020:  5018 fa3a 83f1 0000 5374 6f70 0d0a       P..:....Stop..
14:17:14.565985 IP (tos 0x0, ttl 255, id 2483, offset 0, flags [none], proto TCP (6), length 40)
    192.168.1.40.personal-agent > 192.168.1.88.55278: Flags [.], cksum 0x76b9 (correct), ack 324, win 8186, length 0
        0x0000:  4500 0028 09b3 0000 ff06 2e4c c0a8 0128  E..(.......L...(
        0x0010:  c0a8 0158 15b3 d7ee 00ae 2e57 beb8 b9f0  ...X.......W....
        0x0020:  5010 1ffa 76b9 0000 504f 5354 202f       P...v...POST./
```

**Comment by frankusb** [comment]
When waiting for the Stop, owntone also stops streaming to a Chromecast speaker.

**Comment by frankusb** [comment]
I don't think this is going to work. rcp_session_shutdown needs to return in a timely manner and change state to OUTPUT_STATE_CONNECTED so owntone will stop streaming. What you have implemented now is similar to the sleeps I previously had when the Soundbridge does not respond quickly. If you want a 15 second timeout, I think you'll have to change the state machine.

**Comment by whatdoineed2do** [comment]
we're intersted in the response on this particular session socket used within the rcp.c module for which in some cases, there is NO response within a given time frame (10s) in the code from last night, and after that, the session socket is closed.  what i've done is given users chance to incrase this timeframe (as i've also seen delays responses in the 11-12s region during the teardown and sending `stop`).

Please use the info in https://github.com/owntone/owntone-server/issues/1389#issuecomment-1024917966 to test the latest.  If you still get forced closes without the full shutdown sequence, then show another wireshark capture.  BUT the code is what i describe above:  it's waiting for the kernel to tell it (via the system call `select`) when the response to the commands (`Stop`) is there.  if theres no data after the requested time - reported by the kernel - the code forcible closes the socket becaue we can't have a shutdown wait forever on the remote side.


we've both seen that sending Stop, GetConnectedServer, ServerDisconect wtihout waiting for the roku ack puts the device in a state that isnt right.  So we try to wait for the roku responses BUT as you point out, we can't wait forever - hence if roku takes more then 15 secs (or whatever you chose to config) then we have to disconnect anyway.

The state machine is fine and decoupled from the timeout and this is very subtly different to your send + sleep + read.

**Comment by frankusb** [comment]
My point is that in rcp_session_shutdown, rcp_session_shutdown_clear is called and then it waits there until the shutdown sequence completes or fails up to the timeout. During this time owntone is still trying to stream to the Soundbridge. The Soundbridge is not streaming so you get:
`[2022-01-29 08:59:51] [  LOG]   player: Output delay detected (behind=1178, max=150), resetting all outputs`
It also interrupted streaming to a Chromecast speaker.

If instead in rcp_session_shutdown, the state is changed from OUTPUT_STATE_STREAMING to OUTPUT_STATE_CONNECTED and it returns, the same existing state machine can continue to be used while stopping the Soundbridge with no limit on delays with the difference that owntone is no longer trying to send mp3 data to the Soundbridge.

**Comment by whatdoineed2do** [comment]
now i understand your point which is different to the lack of response to Stop command.

in rcp.c:738, after `rcp_send(s, RCP_STATE_SHUTDOWN_STOPPED, "Stop");`, add `rcp_status(s)` and let me know .. that should translate our state, `RCP_STATE_SHUTDOWN_STOPPED` into `OUTPUT_STATE_STOPPED` and prevent the problem.

**Comment by frankusb** [comment]
That did not work for me.

`[2022-01-29 09:58:18] [  LOG]   player: Bug! Output backend called us with an illegal callback id (32611)`

**Comment by whatdoineed2do** [comment]
check the last commit, 42e74de96d - it does the transition that you mention on shutdown.  puts it into `OUTPUTS_STATE_CONNECTED` (not `OUT...STREAMING`) and it removes the player `output delay`

Tested wiht my test harness controlling the amount of delay - anything above 1-2s delay in the shutdwon would have compalined - i put a 8sec delay in the harness response to stop and it was fine.

**Comment by frankusb** [comment]
It worked once when the Stop command responded in a timely manner but did not when the Stop command took a few seconds.

[2022-01-29 14:24:34] [  LOG]   player: Output delay detected (behind=1103, max=150), resetting all outputs
[2022-01-29 14:25:00] [  LOG]   player: Output delay detected (behind=1106, max=150), resetting all outputs

I think you need to return from rcp_session_shutdown and complete the shutdown due to calls to rcp_listen_cb.

**Comment by frankusb** [comment]
Other than that, looks good to me. It's curious why the Stop command causes the Soundbridge so much grief but there's nothing that can be done about that I think.

**Comment by whatdoineed2do** [comment]
> Is stream_port a new undocumented entry in general in the config file?
> 
> httpd_port = cfg_getint(cfg_getsec(cfg, "general"), "stream_port");

yikes... that's a copy/paste error thanks for spotting.  fixed along with the missing mdns notification handling to remove

**Comment by whatdoineed2do** [comment]
> Other than that, looks good to me. It's curious why the Stop command causes the Soundbridge so much grief but there's nothing that can be done about that I think.

i've noticed it less than your side but i've stil seen in now and again.  given that you want your roku to go into "please select library mode", i wonder if you could simply skip that and ask for conencted server: in `rcp_session+shudown_init()`, replace `rcp_send(s, RCP_STATE_SHUTDOWN_STOPPED` with `RCP_STATE_SHUTDOWN_GET_CONNECTED_SERVER` and see if that makes any difference...  we're disconnecting the library and powering down anyway

if you can give the review branch a go taht'll be good.  i think everything is addressed now

**Comment by frankusb** [comment]
I thought I tried that and it did not work, but I just tried it on the telnet interface and it worked perfect. It reconnected on command as well.

```
roku: ready
GetConnectedServer
GetConnectedServer: OK
ServerDisconnect
ServerDisconnect: TransactionInitiated
ServerDisconnect: Disconnected
ServerDisconnect: TransactionComplete
SetPowerState standby
SetPowerState: OK
SetPowerState on no
SetPowerState: OK
GetConnectedServer
GetConnectedServer: GenericError
ServerDisconnect
ServerDisconnect: ErrorDisconnected
SetServerFilter radio
SetServerFilter: OK
ListServers
ListServers: ListResultSize 1
ListServers: Internet Radio
ListServers: ListResultEnd
ServerConnect 0
ServerConnect: TransactionInitiated
ServerConnect: Connected
ServerConnect: TransactionComplete
ClearWorkingSong
ClearWorkingSong: OK
SetWorkingSongInfo title OwnTone oberon stream
SetWorkingSongInfo: OK
SetWorkingSongInfo playlistURL http://legacy.radioparadise.com/m3u/mp3-128.m3u
SetWorkingSongInfo: OK
SetWorkingSongInfo remoteStream 1
SetWorkingSongInfo: OK
QueueAndPlayOne working
QueueAndPlayOne: OK


GetConnectedServer
GetConnectedServer: OK
ServerDisconnect
ServerDisconnect: TransactionInitiated
ServerDisconnect: Disconnected
ServerDisconnect: TransactionComplete
SetPowerState standby
SetPowerState: OK
```

**Comment by frankusb** [comment]
> in `rcp_session+shudown_init()`, replace `rcp_send(s, RCP_STATE_SHUTDOWN_STOPPED` with `RCP_STATE_SHUTDOWN_GET_CONNECTED_SERVER` and see if that makes any difference... we're disconnecting the library and powering down anyway

Winner, winner, chicken dinner. This works perfectly. I tried to transition as quickly as possible and let it play for a bit and never saw a delay.

**Comment by frankusb** [comment]
Something is happening when the volume is changed from the web page. I could not get the web page to set the volume to 100. This is required to be able to get bit perfect playback when streaming directly. So a Soundbridge connected to a receiver will likely always be at 100. Trying to set to 100 gets mapped to a volume of 10.

But just setting the volume to arbitrary points caused buffering issues. It seemed to happen when the volume was set higher than 50%.

[owntone.log.zip](https://github.com/owntone/owntone-server/files/7987123/owntone.log.zip)

**Comment by frankusb** [comment]
I think the below will do the trick.

```
--- a/src/outputs/rcp.c
+++ b/src/outputs/rcp.c
@@ -1256,7 +1256,7 @@ static int
 rcp_device_volume_set(struct output_device *device, int callback_id)
 {
   struct rcp_session *s = device->session;
-  char cmd[3];
+  char cmd[4];
   int ret;
 
   DPRINTF(E_DBG, L_RCP, "device volume set %ld '%s' state=%d vol=%d\n", device->id, device->name, s->state, device->volume);
```

**Comment by ejurgensen** [comment]
Closed with #1397

**Comment by frankusb** [comment]
@whatdoineed2do what MP3 bit rate do you transcode to?

streaming {
  sample_rate
  bit_rate
}

**Comment by whatdoineed2do** [comment]
> @whatdoineed2do what MP3 bit rate do you transcode to?
> 
> streaming { sample_rate bit_rate }

44100 and 192

Fwiw I was looks at httpd streaming.c to figure out if it's possible to only downscale but haven't figured out how to determine the incoming bit rate

**Comment by frankusb** [comment]
I am curious if that would explain the apparent difference in responses to Volume commands between us. I stream at 320/44100. Most of my collection is FLAC so there is no upscaling possible.

**Comment by frankusb** [comment]
Today I did an experiment. I started a playlist from owntone and selected an M2000 as a speaker and it started playing. Almost every time I tried to adjust the M2000 volume using owntone, the M2000 would rebuffer the stream. Then I used [Remote for SoundBridge](https://play.google.com/store/apps/details?id=de.kompf.android.rokucontrol) and connected to the M2000. It showed what the M2000 was playing and I was able to adjust the volume multiple times without causing a rebuffer.
