### ISSUE TITLE
One core pegged at 100%

### ISSUE THREAD

**Issue by Porco-Rosso** [owntone/owntone-server#1285]
Hi,

I am running the latest master of owntone, and for some reason, one of the cores remains pegged at 100%.

I saw two other issues related to 100% cpu locks, but I doubt I have the same issue. Neither do I have a any playlists with "" or any sort of client that might be keeping open a websockets connection. Running Owntone on debug mode does not give any clues either...

The only suspicious lines are below. 

```
[2021-07-05 13:27:03] [DEBUG]      mpd: Asynchronous listener callback called with event type 12.
[2021-07-05 13:27:03] [DEBUG]      web: notify callback reason: 71
[2021-07-05 13:27:03] [DEBUG]      mpd: Notify clients waiting for idle results: 12
```
Seeing as I don't have an MPD client neither. Maybe it is relted to Zerotier, and associated broadcasts? I'm not sure how to debug any further. Some help would be appreciated even if this isn't such a big issue.

**Comment by Porco-Rosso** [comment]
![image](https://user-images.githubusercontent.com/7024527/124504581-73c29480-ddd0-11eb-805e-39f85683566e.png)
htop showing the threads

**Comment by ejurgensen** [comment]
You can make htop show the thread names with F2 > Display options > Show custom thread names. Might help narrow down the culprit.

**Comment by Porco-Rosso** [comment]
Sadly it doesn't seem to show any more information
![image](https://user-images.githubusercontent.com/7024527/124510801-4a5c3580-dddd-11eb-9468-67b9a2eb7cbf.png)

**Comment by ejurgensen** [comment]
Ok, seems the troublesome thread is anonymous. It could be the websocket thread, so now I have added a commit that names that. Do you have the option of rebuilding from latest master? Otherwise let me know - there may also be other ways of finding out.

**Comment by Porco-Rosso** [comment]
Sure, as you suspected, it's the websockets
![image](https://user-images.githubusercontent.com/7024527/124513250-09671f80-dde3-11eb-877f-301790d37319.png)

**Comment by ejurgensen** [comment]
A few questions: What version of libwebsockets is it? And what platform? Does the issue occur even without you opening the web ui after restart?

**Comment by Porco-Rosso** [comment]
The version is 2.0.3-3 I believe I had to manually install it when I was first setting it up.
Yes, from what I can tell this happens without me opening the webui.
I just installed Homeassistant, but this was a problem before that (and when it is not running)

**Comment by ejurgensen** [comment]
That’s pretty old, I suggest you try upgrading to v 3+

**Comment by Porco-Rosso** [comment]
Any hints on how to install/compile it? The Debian 10 version is like you say very old (2.0.3-3), but installing the newest version from [Debain 11](https://debian.pkgs.org/11/debian-main-arm64/libwebsockets-dev_4.0.20-2_arm64.deb.html) fails because of unmet dependencies, which all have their own dependencies.

Trying to build from source I get stuck at:

```
/root/libwebsockets/lib/tls/openssl/openssl-server.c: In function ‘lws_tls_server_certs_load’:
/root/libwebsockets/lib/tls/openssl/openssl-server.c:299:38: error: dereferencing pointer to incomplete type ‘lws_tls_ctx’ {aka ‘struct ssl_ctx_st’}
  x = sk_X509_value(vhost->tls.ssl_ctx->extra_certs, 0);
                                      ^~
make[2]: *** [CMakeFiles/websockets_shared.dir/build.make:440: CMakeFiles/websockets_shared.dir/lib/tls/openssl/openssl-server.c.o] Error 1
make[1]: *** [CMakeFiles/Makefile2:105: CMakeFiles/websockets_shared.dir/all] Error 2
make: *** [Makefile:152: all] Error 2
```
The fix is over my head I must say: https://github.com/warmcat/libwebsockets/issues/1899

Maybe I'll upgrade to debian 11, but I rather not as it is still unstable.

**Comment by ejurgensen** [comment]
Sorry, I retract my advice, it's usually best to use stock versions, so if Debian 10 has 2.0 then owntone must work with that. I don't, however, seem to have this issue on my RPi that also runs Buster and has 2.0.3-3, so not sure what is going on. Is there anything specific to your configuration that you thing might cause this? I notice you wrote that you manually installed libwebsockets - why was that?

**Comment by Porco-Rosso** [comment]
Ah, I already figured it out.
Giving it another shot I was able to update libwebsockets with 
https://debian.pkgs.org/11/debian-main-amd64/libwebsockets16_4.0.20-2_amd64.deb.html
and
https://debian.pkgs.org/11/debian-main-amd64/libwebsockets-dev_4.0.20-2_amd64.deb.html

unfortunately, the cpu peg problem is still there.

**Comment by Porco-Rosso** [comment]
I honestly can't recall I think I needed to manually install libwebsockets-dev when I first started building owntone (forked-daapd) from scratch. I think I was on an even older version of debian and have since updated. This probably meant the package was updated to Debian 10's version.

**Comment by ejurgensen** [comment]
I've now tried to install & run owntone on a virgin Debian Buster vm, and I could not reproduce the cpu issue. Some other things you could check:

- check with Wireshark if something is connecting to websockets (port 3688) and causing this
- attach gdb to the owntone process and find out what the thread is doing (you will have to google the details on how to do this - it is somewhat complicated, so I understand if you are not up to it)

**Comment by Porco-Rosso** [comment]
sorry for the long delay with the feedback,
I think gdb is over my head, but I will try reading up more on how to do it.

I have tried disconnecting the network interface and the core is still pegged at 100%
I also tried strace and lsof from htop, see result below:
![Screen Shot 2021-07-26 at 8 08 40 PM](https://user-images.githubusercontent.com/7024527/127030933-47f44d13-9b90-49cb-82bc-4cebfc25da3c.png)
![Screen Shot 2021-07-26 at 8 09 27 PM](https://user-images.githubusercontent.com/7024527/127030940-a635455b-be14-41cc-a2c0-e59ff64628c5.png)

**Comment by ejurgensen** [comment]
@chme do you have any suggestions on this?

**Comment by Porco-Rosso** [comment]
Perhaps it has to do with inotify? is there a way to disable it in the config?

**Comment by ejurgensen** [comment]
> Perhaps it has to do with inotify?

Not sure what points at that? It seems to be the websockets thread

**Comment by Porco-Rosso** [comment]
I just tried to run `tcpdump -w /tmp/capture_data -s 8192 port 3688` and `tcpdump port 3688` but no packets were captured outside of regular operation (only when I played, paused a song etc)

**Comment by Porco-Rosso** [comment]
Just updated to the latest master, and the problem persists.
I tried running wireshark (tshark)
Ran on TCP and UDP on ports 3688 and 3689, however this is the only thing that came up. It seems rather normal.

```
tshark -f "tcp port 3688" -i any
Running as user "root" and group "root". This could be dangerous.
Capturing on 'any'
    1 0.000000000 192.168.1.121 → 192.168.1.111 TCP 74 38154 → 3688 [PSH, ACK] Seq=1 Ack=1 Win=501 Len=6 TSval=1066729811 TSecr=2132314460
    2 0.000024658 192.168.1.111 → 192.168.1.121 TCP 70 3688 → 38154 [PSH, ACK] Seq=1 Ack=7 Win=507 Len=2 TSval=2132345459 TSecr=1066729811
    3 0.000340245 192.168.1.121 → 192.168.1.111 TCP 68 38154 → 3688 [ACK] Seq=7 Ack=3 Win=501 Len=0 TSval=1066729811 TSecr=2132345459
    4 8.222349805 192.168.1.241 → 192.168.1.111 TCP 62 50284 → 3688 [ACK] Seq=1 Ack=1 Win=2056 Len=0
    5 8.222356766 192.168.1.111 → 192.168.1.241 TCP 68 [TCP ACKed unseen segment] 3688 → 50284 [ACK] Seq=1 Ack=2 Win=505 Len=0 TSval=1675300373 TSecr=4166752657
    6 31.000639983 192.168.1.121 → 192.168.1.111 TCP 74 38154 → 3688 [PSH, ACK] Seq=7 Ack=3 Win=501 Len=6 TSval=1066760812 TSecr=2132345459
    7 31.000665739 192.168.1.111 → 192.168.1.121 TCP 70 3688 → 38154 [PSH, ACK] Seq=3 Ack=13 Win=507 Len=2 TSval=2132376460 TSecr=1066760812
    8 31.000716067 192.168.1.121 → 192.168.1.111 TCP 68 38154 → 3688 [ACK] Seq=13 Ack=5 Win=501 Len=0 TSval=1066760812 TSecr=2132376460
```
Tried filtering for websocket on eth0, but the only packet is from me reloading the webui...
``` 
tshark -Y 'websocket'
Running as user "root" and group "root". This could be dangerous.
Capturing on 'eth0'
  158 11.096397261 192.168.1.241 → 192.168.1.111 WebSocket 179 WebSocket Text [FIN] [MASKED]
1 packet captured
```

I've tried disabling zerotier, disabling my nginx reverse-proxy, disabling homeassistant on another VM, but nothing has made a difference. It seems to be an internal problem with the websocket library. @ejurgensen Do you have a recommended version of libwebsockets to run?
@chme do you have any suggestions on what else I can try?

**Comment by ejurgensen** [comment]
To help you with this I would need a way of reproducing the issue. Would you be able to provide a recipe for duplicating your setup in a vm?

**Comment by Porco-Rosso** [comment]
I am using an LXC container via proxmox, so I suppose I could alter the root password, and send you the container image.
However I think I will just entirely rebuild the VM from scratch at this point. If I get the same error again I will follow up with the image, or steps I took.

**Comment by Porco-Rosso** [comment]
Okay, so I finally got around to rebuilding the container from scratch, and the error seems to have gone away. I also didn't need to manually install any libwebsocket packages, so seems like something was just off with my config. Thanks for the support as always!

**Comment by ejurgensen** [comment]
Thanks for the update!
